Model,Component,Feature,ConnectionInstance
AADLib_mars_pathfinder_sys_mars_pathfinder_impl_1,"VME, bus_1553, radio, coupler, camera, altimeter, accelerometer, meterological, sun_sensors, star_analyser, thrusters, valves, memories, prs_PSC, data_rw, bus_scheduling, data_distribution, control_task, radio_task, camera_task, mesure_task, meteo_task, rs_6000","emission_data, reception_data, req_access_vme, camera_control, emission_data, control_data, reception_data, images_data, measured_data, req_access_1553, camera_control, images_data, req_access_vme, measured_data, req_access_1553, X, Y, Z, measured_data, req_access_1553, measured_data, req_access_1553, measured_data, req_access_1553, measured_data, req_access_1553, control_data, req_access_1553, control_data, req_access_1553, req_access_vme, camera_control, emission_data, control_data, reception_data, images_data, measured_data, control_data, measured_data, req_data_rw, req_data_rw, reception_data, emission_data, images_data, camera_control, req_data_rw, req_data_rw, req_access_vme","data_rw -> data_distribution.req_data_rw, data_rw -> control_task.req_data_rw, data_rw -> mesure_task.req_data_rw, data_rw -> meteo_task.req_data_rw, data_distribution.req_data_rw -> data_rw, control_task.req_data_rw -> data_rw, mesure_task.req_data_rw -> data_rw, meteo_task.req_data_rw -> data_rw, VME -> camera.req_access_vme, VME -> radio.req_access_vme, VME -> memories.req_access_vme, VME -> rs_6000.req_access_vme, bus_1553 -> valves.req_access_1553, bus_1553 -> thrusters.req_access_1553, bus_1553 -> sun_sensors.req_access_1553, bus_1553 -> star_analyser.req_access_1553, bus_1553 -> meterological.req_access_1553, bus_1553 -> coupler.req_access_1553, radio.reception_data -> prs_PSC.radio_task.reception_data, radio.req_access_vme -> VME, coupler.req_access_1553 -> bus_1553, camera.images_data -> prs_PSC.camera_task.images_data, camera.req_access_vme -> VME, altimeter.measured_data -> prs_PSC.data_distribution.measured_data, accelerometer.measured_data -> prs_PSC.data_distribution.measured_data, meterological.measured_data -> prs_PSC.data_distribution.measured_data, meterological.req_access_1553 -> bus_1553, sun_sensors.measured_data -> prs_PSC.data_distribution.measured_data, sun_sensors.req_access_1553 -> bus_1553, star_analyser.measured_data -> prs_PSC.data_distribution.measured_data, star_analyser.req_access_1553 -> bus_1553, thrusters.req_access_1553 -> bus_1553, valves.req_access_1553 -> bus_1553, memories.req_access_vme -> VME, prs_PSC.bus_scheduling.control_data -> valves.control_data, prs_PSC.bus_scheduling.control_data -> thrusters.control_data, prs_PSC.radio_task.emission_data -> radio.emission_data, prs_PSC.camera_task.camera_control -> camera.camera_control, rs_6000.req_access_vme -> VME"
AADLib_MinePump_BA_MinePump_impl_1,"Software, WaterLevelMonitoring_Thread, MethaneMonitoring_Thread, PumpCtrl_Thread, WaterAlarm_Thread, Hardware","WaterAlarm, MethaneLevel, WaterAlarm, MethaneLevel, WaterLevel, WaterAlarm","WaterLevelMonitoring_Thread.WaterAlarm -> PumpCtrl_Thread.WaterLevel, MethaneMonitoring_Thread.MethaneLevel -> PumpCtrl_Thread.MethaneLevel, PumpCtrl_Thread.WaterAlarm -> WaterAlarm_Thread.WaterAlarm"
AADLib_MinePump_MinePump_impl_1,"Software, WaterLevelMonitoring_Thread, MethaneMonitoring_Thread, PumpCtrl_Thread, WaterAlarm_Thread, Hardware","WaterAlarm, MethaneLevel, WaterAlarm, MethaneLevel, WaterLevel, WaterAlarm","WaterLevelMonitoring_Thread.WaterAlarm -> PumpCtrl_Thread.WaterLevel, MethaneMonitoring_Thread.MethaneLevel -> PumpCtrl_Thread.MethaneLevel, PumpCtrl_Thread.WaterAlarm -> WaterAlarm_Thread.WaterAlarm"
AADLib_minirocket_system_minirocket_impl_1,"I2C_bus, USB1_bus, UART1_bus, UART2_bus, TWI_ARM9, UART1_ARM9, UART2_ARM9, USB1_ARM9, PRESSURE, INERTIAL, GPS, CAMERA, proc_2, TM_manager, TC_manager, PRESSURE_manager, CL_manager, SE_manager, D_manager, GPS_manager, INERTIAL_manager, CAMERA_manager, CPU_ARM9","Serial_Wire, Serial_Wire, Serial_Wire, Serial_Wire, proc_evt, Serial_Wire, proc_evt, Serial_Wire, proc_evt, Serial_Wire, proc_evt, Serial_Wire, Supply, TC_frame, TM_frame, PRESSURE_meas, TM_frame, TC_frame, PRESSURE_meas, State_estimation, TC_frame, State_estimation, TM_frame, GPS_meas, INERTIAL_meas, Decision, Decision, CAMERA_meas, GPS_meas, INERTIAL_meas, CAMERA_meas, Supply","PRESSURE_manager.PRESSURE_meas -> TM_manager.PRESSURE_meas, SE_manager.State_estimation -> CL_manager.State_estimation, D_manager.Decision -> SE_manager.Decision, GPS_manager.GPS_meas -> SE_manager.GPS_meas, INERTIAL_manager.INERTIAL_meas -> SE_manager.INERTIAL_meas, CAMERA_manager.CAMERA_meas -> D_manager.CAMERA_meas, I2C_bus -> TWI_ARM9.Serial_Wire, I2C_bus -> PRESSURE.Serial_Wire, USB1_bus -> USB1_ARM9.Serial_Wire, USB1_bus -> CAMERA.Serial_Wire, UART1_bus -> UART1_ARM9.Serial_Wire, UART1_bus -> GPS.Serial_Wire, UART2_bus -> UART2_ARM9.Serial_Wire, UART2_bus -> INERTIAL.Serial_Wire"
AADLib_Mixin_Demo_impl_1,"Mix_1, Mix_2","Port_1, Port_2, Port_1, Port_2",
AADLib_MoDeVVa_modevva_impl_1,"Proc, mbx, regulate, display, acquire, CPU","mbx, mbx","mbx -> regulate.mbx, mbx -> display.mbx"
AADLib_Pacemaker_Pkg_DeviceControllerMonitor_others_1,"Lead, PacemakerSW, VRPTimeout, LRLTimeout, VVIMode, vrp, HWPlatform","VentricleSense, VentriclePulse, Normal_Beat, s, p, n, input, output, input, output, s, lrl_timeout, vrp_timeout, p, n, p_or_n1, p_or_n2","VRPTimeout.output -> VVIMode.vrp_timeout, LRLTimeout.output -> VVIMode.lrl_timeout, VVIMode.p_or_n1 -> VRPTimeout.input, VVIMode.p_or_n2 -> LRLTimeout.input, Lead.VentricleSense -> PacemakerSW.VVIMode.s, PacemakerSW.VVIMode.p -> Lead.VentriclePulse, PacemakerSW.VVIMode.n -> Lead.Normal_Beat"
AADLib_paparazzi_system_airborne_impl_1,"SPI_Bus, fly_by_wire, Mem_Bus, Dev_Bus, Recpt_dv, Cpt_dv, Ser_Rudder_dv, Ser_Elevator_dv, Ser_AileronL_dv, Ser_AileronR_dv, Ser_MotorL_dv, Ser_MotorR_dv, Ram, Proc_RcptCde_PilotServ, System_Mode, Radio_Ok, Radio_Really_Lost, Mega128_Ok, Rec_Dec_Th, Send_Th, Pilot_Serv_Th, Check_Ap_Th, Check_Fail_Th, Interrupt_Elevator_Th, Interrupt_MotorL_Th, Interrupt_MotorR_Th, Interrupt_AileronL_Th, Interrupt_AileronR_Th, Interrupt_Rudder_Th, Interrupt_SPI_1, Interrupt_RC_Th, MCU1_P, autopilot, Mem_Bus, Dev_Bus, Modem_Bus, P_dv, T_dv, Compas_dv, V_Air_dv, Cam_dv, Emet_dv, GPS_dv, IR_dv, Ram, N_S_C_proc, AP_Data, channels, data_0, data_1, data_2, data_3, data_4, data_5, data_6, data_7, data_8, ppm_cpt, satus, nb_err, vsupply, Data_Acq_Filt_Th, Alt_Ctrl_Th, Nav_Th, Climb_Ctrl_Th, Stab_Th, Send_MCU1_Th, Send_Grd_Station_Th, Interrupt_SPI_Th1, Interrupt_SPI_Th2, Interrupt_Modem_Th, Interrupt_GPS_Th, Ctrl_By_RC_Th, Proc_0","RC_EvtData_Input, SPI_Con, RC_EvtData_Input, AP_EvtData_Input, D_MCU1_Output, RC_Input, RC_Output, RC_Evt_Output, Dev_Bus, Data_Elev_Input, Data_AilL_Input, Data_AilR_Input, Data_MotorL_Input, Data_MotorR_Input, Data_Rudder_Input, Data_Elev_Output, Data_AilL_Output, Data_AilR_Output, Data_MotorL_Output, Data_MotorR_Output, Data_Rudder_Output, Dev_Bus, Data_Input, Dev_bus, Data_Input, Dev_bus, Data_Input, Dev_bus, Data_Input, Dev_bus, Data_Input, Dev_bus, Data_Input, Dev_bus, Mem_Bus, Cde_Elevator_Output, Cde_MotorL_Output, Cde_MotorR_Output, Cde_AileronL_Output, Cde_AileronR_Output, Cde_Rudder_Output, Radio_Cdes_Input, AP_Cdes_Input, Cdes_Vol_Output, RC_Evt_Input, MCU1_Data_Input, Radio_Ok_Input, Radio_Really_Lost_Input, MCU1_Send_Output, Data_Output, Signal_Input, Data_Output, Signal_Input, Data_Output, Signal_Input, Data_Output, Signal_Input, Data_Output, Signal_Input, Data_Output, Signal_Input, Data_Rec_MCU1_Output, Evt_Rec_SPI_Input, Data_Send_SPI_Output, Evt_Send_SPI_Input, AP_Evt_Output, RC_Evt_Input, Mem_Bus, Dev_Bus, SPI, SPI_Con, D_MCU1_Input, D_MCU0_Output, P_Output, Dev_Bus, T_Output, Dev_Bus, Compas_Output, Dev_Bus, V_Air_Output, Dev_Bus, Video_Output, Dev_Bus, Video_Input, Trans_Data_Output, Video_Output, Trans_Data_Input, Modem_Bus, Dev_Bus, GPS_Output, Error_Output, Dev_Bus, IR_Output, Error_Output, Dev_Bus, Mem_Bus, IR_Input, P_Input, T_Input, Compas_Input, V_Air_Input, MCU1_Data_Input, GPS_Input, Trans_MCU0_Output, Trans_Sol_Output, GPS_Evt_Input, GPS_Output, Altitude_Desiree_Input, Montee_Desiree_Output, GPS_Data_Input, Altitude_Desiree_Output, Montee_Desiree_Input, IR_Input, MCU0_Send_Output, Data_Output, Evt_Rec_SPI_Input, Data_Rec_MCU0_Output, Data_Send_SPI_Output, Evt_Send_SPI_Input, Data_Rec_MCU0_Output, Data_Send_SPI_Output, Data_Send_SPI_Input, Data_Rec_MCU0_Input, Data_Input, Data_Output, GPS_Input, Mem_Bus, Dev_Bus, SPI","Send_Th.MCU1_Send_Output -> Interrupt_SPI_1.Evt_Send_SPI_Input, Mem_Bus -> MCU1_P.Mem_Bus, Mem_Bus -> Ram.Mem_Bus, Dev_Bus -> MCU1_P.Dev_Bus, Dev_Bus -> Recpt_dv.Dev_Bus, Dev_Bus -> Cpt_dv.Dev_Bus, Dev_Bus -> Ser_Rudder_dv.Dev_bus, Dev_Bus -> Ser_Elevator_dv.Dev_bus, Dev_Bus -> Ser_AileronL_dv.Dev_bus, Dev_Bus -> Ser_AileronR_dv.Dev_bus, Dev_Bus -> Ser_MotorL_dv.Dev_bus, Dev_Bus -> Ser_MotorR_dv.Dev_bus, Recpt_dv.RC_Output -> Proc_RcptCde_PilotServ.Interrupt_RC_Th.RC_Evt_Input, Recpt_dv.RC_Evt_Output -> Proc_RcptCde_PilotServ.RC_Evt_Input, Cpt_dv.Data_Elev_Output -> Ser_Elevator_dv.Data_Input, Cpt_dv.Data_AilL_Output -> Ser_AileronL_dv.Data_Input, Cpt_dv.Data_AilR_Output -> Ser_AileronR_dv.Data_Input, Cpt_dv.Data_MotorL_Output -> Ser_MotorL_dv.Data_Input, Cpt_dv.Data_MotorR_Output -> Ser_MotorR_dv.Data_Input, Cpt_dv.Data_Rudder_Output -> Ser_Rudder_dv.Data_Input, Proc_RcptCde_PilotServ.Interrupt_Elevator_Th.Data_Output -> Cpt_dv.Data_Elev_Input, Proc_RcptCde_PilotServ.Interrupt_MotorL_Th.Data_Output -> Cpt_dv.Data_MotorL_Input, Proc_RcptCde_PilotServ.Interrupt_MotorR_Th.Data_Output -> Cpt_dv.Data_MotorR_Input, Proc_RcptCde_PilotServ.Interrupt_AileronL_Th.Data_Output -> Cpt_dv.Data_AilL_Input, Proc_RcptCde_PilotServ.Interrupt_AileronR_Th.Data_Output -> Cpt_dv.Data_AilR_Input, Proc_RcptCde_PilotServ.Interrupt_Rudder_Th.Data_Output -> Cpt_dv.Data_Rudder_Input, Data_Acq_Filt_Th.GPS_Output -> Nav_Th.GPS_Data_Input, Alt_Ctrl_Th.Montee_Desiree_Output -> Climb_Ctrl_Th.Montee_Desiree_Input, Nav_Th.Altitude_Desiree_Output -> Alt_Ctrl_Th.Altitude_Desiree_Input, Send_MCU1_Th.MCU0_Send_Output -> Interrupt_SPI_Th1.Evt_Send_SPI_Input, Send_Grd_Station_Th.Data_Output -> Interrupt_Modem_Th.Data_Input, Interrupt_SPI_Th1.Data_Rec_MCU0_Output -> Interrupt_SPI_Th2.Data_Rec_MCU0_Input, Interrupt_SPI_Th1.Data_Send_SPI_Output -> Interrupt_SPI_Th2.Data_Send_SPI_Input, Mem_Bus -> Proc_0.Mem_Bus, Mem_Bus -> Ram.Mem_Bus, Dev_Bus -> Proc_0.Dev_Bus, Dev_Bus -> P_dv.Dev_Bus, Dev_Bus -> T_dv.Dev_Bus, Dev_Bus -> Compas_dv.Dev_Bus, Dev_Bus -> V_Air_dv.Dev_Bus, Dev_Bus -> Cam_dv.Dev_Bus, Dev_Bus -> Emet_dv.Dev_Bus, Dev_Bus -> GPS_dv.Dev_Bus, Dev_Bus -> IR_dv.Dev_Bus, Modem_Bus -> Emet_dv.Modem_Bus, P_dv.P_Output -> N_S_C_proc.P_Input, T_dv.T_Output -> N_S_C_proc.T_Input, Compas_dv.Compas_Output -> N_S_C_proc.Compas_Input, V_Air_dv.V_Air_Output -> N_S_C_proc.V_Air_Input, Cam_dv.Video_Output -> Emet_dv.Video_Input, GPS_dv.GPS_Output -> N_S_C_proc.Interrupt_GPS_Th.GPS_Input, GPS_dv.Error_Output -> N_S_C_proc.GPS_Evt_Input, N_S_C_proc.Interrupt_Modem_Th.Data_Output -> Emet_dv.Trans_Data_Input, RC_EvtData_Input -> fly_by_wire.Recpt_dv.RC_Input, SPI_Bus -> autopilot.SPI_Con, SPI_Bus -> fly_by_wire.SPI_Con, fly_by_wire.Proc_RcptCde_PilotServ.Interrupt_SPI_1.Data_Send_SPI_Output -> autopilot.N_S_C_proc.Interrupt_SPI_Th1.Evt_Rec_SPI_Input, autopilot.N_S_C_proc.Interrupt_SPI_Th2.Data_Send_SPI_Output -> fly_by_wire.Proc_RcptCde_PilotServ.Interrupt_SPI_1.Evt_Rec_SPI_Input"
AADLib_paparazzi_system_paparazzi_basic_archi_1,"airborne, SPI_Bus, fly_by_wire, Mem_Bus, Dev_Bus, Recpt_dv, Cpt_dv, Ser_Rudder_dv, Ser_Elevator_dv, Ser_AileronL_dv, Ser_AileronR_dv, Ser_MotorL_dv, Ser_MotorR_dv, Ram, Proc_RcptCde_PilotServ, System_Mode, Radio_Ok, Radio_Really_Lost, Mega128_Ok, Rec_Dec_Th, Send_Th, Pilot_Serv_Th, Check_Ap_Th, Check_Fail_Th, Interrupt_Elevator_Th, Interrupt_MotorL_Th, Interrupt_MotorR_Th, Interrupt_AileronL_Th, Interrupt_AileronR_Th, Interrupt_Rudder_Th, Interrupt_SPI_1, Interrupt_RC_Th, MCU1_P, autopilot, Mem_Bus, Dev_Bus, Modem_Bus, P_dv, T_dv, Compas_dv, V_Air_dv, Cam_dv, Emet_dv, GPS_dv, IR_dv, Ram, N_S_C_proc, AP_Data, channels, data_0, data_1, data_2, data_3, data_4, data_5, data_6, data_7, data_8, ppm_cpt, satus, nb_err, vsupply, Data_Acq_Filt_Th, Alt_Ctrl_Th, Nav_Th, Climb_Ctrl_Th, Stab_Th, Send_MCU1_Th, Send_Grd_Station_Th, Interrupt_SPI_Th1, Interrupt_SPI_Th2, Interrupt_Modem_Th, Interrupt_GPS_Th, Ctrl_By_RC_Th, Proc_0","RC_EvtData_Input, SPI_Con, RC_EvtData_Input, AP_EvtData_Input, D_MCU1_Output, RC_Input, RC_Output, RC_Evt_Output, Dev_Bus, Data_Elev_Input, Data_AilL_Input, Data_AilR_Input, Data_MotorL_Input, Data_MotorR_Input, Data_Rudder_Input, Data_Elev_Output, Data_AilL_Output, Data_AilR_Output, Data_MotorL_Output, Data_MotorR_Output, Data_Rudder_Output, Dev_Bus, Data_Input, Dev_bus, Data_Input, Dev_bus, Data_Input, Dev_bus, Data_Input, Dev_bus, Data_Input, Dev_bus, Data_Input, Dev_bus, Mem_Bus, Cde_Elevator_Output, Cde_MotorL_Output, Cde_MotorR_Output, Cde_AileronL_Output, Cde_AileronR_Output, Cde_Rudder_Output, Radio_Cdes_Input, AP_Cdes_Input, Cdes_Vol_Output, RC_Evt_Input, MCU1_Data_Input, Radio_Ok_Input, Radio_Really_Lost_Input, MCU1_Send_Output, Data_Output, Signal_Input, Data_Output, Signal_Input, Data_Output, Signal_Input, Data_Output, Signal_Input, Data_Output, Signal_Input, Data_Output, Signal_Input, Data_Rec_MCU1_Output, Evt_Rec_SPI_Input, Data_Send_SPI_Output, Evt_Send_SPI_Input, AP_Evt_Output, RC_Evt_Input, Mem_Bus, Dev_Bus, SPI, SPI_Con, D_MCU1_Input, D_MCU0_Output, P_Output, Dev_Bus, T_Output, Dev_Bus, Compas_Output, Dev_Bus, V_Air_Output, Dev_Bus, Video_Output, Dev_Bus, Video_Input, Trans_Data_Output, Video_Output, Trans_Data_Input, Modem_Bus, Dev_Bus, GPS_Output, Error_Output, Dev_Bus, IR_Output, Error_Output, Dev_Bus, Mem_Bus, IR_Input, P_Input, T_Input, Compas_Input, V_Air_Input, MCU1_Data_Input, GPS_Input, Trans_MCU0_Output, Trans_Sol_Output, GPS_Evt_Input, GPS_Output, Altitude_Desiree_Input, Montee_Desiree_Output, GPS_Data_Input, Altitude_Desiree_Output, Montee_Desiree_Input, IR_Input, MCU0_Send_Output, Data_Output, Evt_Rec_SPI_Input, Data_Rec_MCU0_Output, Data_Send_SPI_Output, Evt_Send_SPI_Input, Data_Rec_MCU0_Output, Data_Send_SPI_Output, Data_Send_SPI_Input, Data_Rec_MCU0_Input, Data_Input, Data_Output, GPS_Input, Mem_Bus, Dev_Bus, SPI","Send_Th.MCU1_Send_Output -> Interrupt_SPI_1.Evt_Send_SPI_Input, Mem_Bus -> MCU1_P.Mem_Bus, Mem_Bus -> Ram.Mem_Bus, Dev_Bus -> MCU1_P.Dev_Bus, Dev_Bus -> Recpt_dv.Dev_Bus, Dev_Bus -> Cpt_dv.Dev_Bus, Dev_Bus -> Ser_Rudder_dv.Dev_bus, Dev_Bus -> Ser_Elevator_dv.Dev_bus, Dev_Bus -> Ser_AileronL_dv.Dev_bus, Dev_Bus -> Ser_AileronR_dv.Dev_bus, Dev_Bus -> Ser_MotorL_dv.Dev_bus, Dev_Bus -> Ser_MotorR_dv.Dev_bus, Recpt_dv.RC_Output -> Proc_RcptCde_PilotServ.Interrupt_RC_Th.RC_Evt_Input, Recpt_dv.RC_Evt_Output -> Proc_RcptCde_PilotServ.RC_Evt_Input, Cpt_dv.Data_Elev_Output -> Ser_Elevator_dv.Data_Input, Cpt_dv.Data_AilL_Output -> Ser_AileronL_dv.Data_Input, Cpt_dv.Data_AilR_Output -> Ser_AileronR_dv.Data_Input, Cpt_dv.Data_MotorL_Output -> Ser_MotorL_dv.Data_Input, Cpt_dv.Data_MotorR_Output -> Ser_MotorR_dv.Data_Input, Cpt_dv.Data_Rudder_Output -> Ser_Rudder_dv.Data_Input, Proc_RcptCde_PilotServ.Interrupt_Elevator_Th.Data_Output -> Cpt_dv.Data_Elev_Input, Proc_RcptCde_PilotServ.Interrupt_MotorL_Th.Data_Output -> Cpt_dv.Data_MotorL_Input, Proc_RcptCde_PilotServ.Interrupt_MotorR_Th.Data_Output -> Cpt_dv.Data_MotorR_Input, Proc_RcptCde_PilotServ.Interrupt_AileronL_Th.Data_Output -> Cpt_dv.Data_AilL_Input, Proc_RcptCde_PilotServ.Interrupt_AileronR_Th.Data_Output -> Cpt_dv.Data_AilR_Input, Proc_RcptCde_PilotServ.Interrupt_Rudder_Th.Data_Output -> Cpt_dv.Data_Rudder_Input, Data_Acq_Filt_Th.GPS_Output -> Nav_Th.GPS_Data_Input, Alt_Ctrl_Th.Montee_Desiree_Output -> Climb_Ctrl_Th.Montee_Desiree_Input, Nav_Th.Altitude_Desiree_Output -> Alt_Ctrl_Th.Altitude_Desiree_Input, Send_MCU1_Th.MCU0_Send_Output -> Interrupt_SPI_Th1.Evt_Send_SPI_Input, Send_Grd_Station_Th.Data_Output -> Interrupt_Modem_Th.Data_Input, Interrupt_SPI_Th1.Data_Rec_MCU0_Output -> Interrupt_SPI_Th2.Data_Rec_MCU0_Input, Interrupt_SPI_Th1.Data_Send_SPI_Output -> Interrupt_SPI_Th2.Data_Send_SPI_Input, Mem_Bus -> Proc_0.Mem_Bus, Mem_Bus -> Ram.Mem_Bus, Dev_Bus -> Proc_0.Dev_Bus, Dev_Bus -> P_dv.Dev_Bus, Dev_Bus -> T_dv.Dev_Bus, Dev_Bus -> Compas_dv.Dev_Bus, Dev_Bus -> V_Air_dv.Dev_Bus, Dev_Bus -> Cam_dv.Dev_Bus, Dev_Bus -> Emet_dv.Dev_Bus, Dev_Bus -> GPS_dv.Dev_Bus, Dev_Bus -> IR_dv.Dev_Bus, Modem_Bus -> Emet_dv.Modem_Bus, P_dv.P_Output -> N_S_C_proc.P_Input, T_dv.T_Output -> N_S_C_proc.T_Input, Compas_dv.Compas_Output -> N_S_C_proc.Compas_Input, V_Air_dv.V_Air_Output -> N_S_C_proc.V_Air_Input, Cam_dv.Video_Output -> Emet_dv.Video_Input, GPS_dv.GPS_Output -> N_S_C_proc.Interrupt_GPS_Th.GPS_Input, GPS_dv.Error_Output -> N_S_C_proc.GPS_Evt_Input, N_S_C_proc.Interrupt_Modem_Th.Data_Output -> Emet_dv.Trans_Data_Input, SPI_Bus -> autopilot.SPI_Con, SPI_Bus -> fly_by_wire.SPI_Con, fly_by_wire.Proc_RcptCde_PilotServ.Interrupt_SPI_1.Data_Send_SPI_Output -> autopilot.N_S_C_proc.Interrupt_SPI_Th1.Evt_Rec_SPI_Input, autopilot.N_S_C_proc.Interrupt_SPI_Th2.Data_Send_SPI_Output -> fly_by_wire.Proc_RcptCde_PilotServ.Interrupt_SPI_1.Evt_Rec_SPI_Input"
AADLib_paparazzi_system_paparazzi_PnP_tasks_interruptions_1,"airborne, SPI_Bus, fly_by_wire, Mem_Bus, Dev_Bus, Recpt_dv, Cpt_dv, Ser_Rudder_dv, Ser_Elevator_dv, Ser_AileronL_dv, Ser_AileronR_dv, Ser_MotorL_dv, Ser_MotorR_dv, Ram, Proc_RcptCde_PilotServ, System_Mode, Radio_Ok, Radio_Really_Lost, Mega128_Ok, Rec_Dec_Th, Send_Th, Pilot_Serv_Th, Check_Ap_Th, Check_Fail_Th, Interrupt_Elevator_Th, Interrupt_MotorL_Th, Interrupt_MotorR_Th, Interrupt_AileronL_Th, Interrupt_AileronR_Th, Interrupt_Rudder_Th, Interrupt_SPI_1, Interrupt_RC_Th, MCU1_P, autopilot, Mem_Bus, Dev_Bus, Modem_Bus, P_dv, T_dv, Compas_dv, V_Air_dv, Cam_dv, Emet_dv, GPS_dv, IR_dv, Ram, N_S_C_proc, AP_Data, channels, data_0, data_1, data_2, data_3, data_4, data_5, data_6, data_7, data_8, ppm_cpt, satus, nb_err, vsupply, Data_Acq_Filt_Th, Alt_Ctrl_Th, Nav_Th, Climb_Ctrl_Th, Stab_Th, Send_MCU1_Th, Send_Grd_Station_Th, Interrupt_SPI_Th1, Interrupt_SPI_Th2, Interrupt_Modem_Th, Interrupt_GPS_Th, Ctrl_By_RC_Th, Proc_0","RC_EvtData_Input, SPI_Con, RC_EvtData_Input, AP_EvtData_Input, D_MCU1_Output, RC_Input, RC_Output, RC_Evt_Output, Dev_Bus, Data_Elev_Input, Data_AilL_Input, Data_AilR_Input, Data_MotorL_Input, Data_MotorR_Input, Data_Rudder_Input, Data_Elev_Output, Data_AilL_Output, Data_AilR_Output, Data_MotorL_Output, Data_MotorR_Output, Data_Rudder_Output, Dev_Bus, Data_Input, Dev_bus, Data_Input, Dev_bus, Data_Input, Dev_bus, Data_Input, Dev_bus, Data_Input, Dev_bus, Data_Input, Dev_bus, Mem_Bus, Cde_Elevator_Output, Cde_MotorL_Output, Cde_MotorR_Output, Cde_AileronL_Output, Cde_AileronR_Output, Cde_Rudder_Output, Radio_Cdes_Input, AP_Cdes_Input, Cdes_Vol_Output, RC_Evt_Input, MCU1_Data_Input, Radio_Ok_Input, Radio_Really_Lost_Input, MCU1_Send_Output, Data_Output, Signal_Input, Data_Output, Signal_Input, Data_Output, Signal_Input, Data_Output, Signal_Input, Data_Output, Signal_Input, Data_Output, Signal_Input, Data_Rec_MCU1_Output, Evt_Rec_SPI_Input, Data_Send_SPI_Output, Evt_Send_SPI_Input, AP_Evt_Output, RC_Evt_Input, Mem_Bus, Dev_Bus, SPI, SPI_Con, D_MCU1_Input, D_MCU0_Output, P_Output, Dev_Bus, T_Output, Dev_Bus, Compas_Output, Dev_Bus, V_Air_Output, Dev_Bus, Video_Output, Dev_Bus, Video_Input, Trans_Data_Output, Video_Output, Trans_Data_Input, Modem_Bus, Dev_Bus, GPS_Output, Error_Output, Dev_Bus, IR_Output, Error_Output, Dev_Bus, Mem_Bus, IR_Input, P_Input, T_Input, Compas_Input, V_Air_Input, MCU1_Data_Input, GPS_Input, Trans_MCU0_Output, Trans_Sol_Output, GPS_Evt_Input, GPS_Output, Altitude_Desiree_Input, Montee_Desiree_Output, GPS_Data_Input, Altitude_Desiree_Output, Montee_Desiree_Input, IR_Input, MCU0_Send_Output, Data_Output, Evt_Rec_SPI_Input, Data_Rec_MCU0_Output, Data_Send_SPI_Output, Evt_Send_SPI_Input, Data_Rec_MCU0_Output, Data_Send_SPI_Output, Data_Send_SPI_Input, Data_Rec_MCU0_Input, Data_Input, Data_Output, GPS_Input, Mem_Bus, Dev_Bus, SPI","Send_Th.MCU1_Send_Output -> Interrupt_SPI_1.Evt_Send_SPI_Input, Mem_Bus -> MCU1_P.Mem_Bus, Mem_Bus -> Ram.Mem_Bus, Dev_Bus -> MCU1_P.Dev_Bus, Dev_Bus -> Recpt_dv.Dev_Bus, Dev_Bus -> Cpt_dv.Dev_Bus, Dev_Bus -> Ser_Rudder_dv.Dev_bus, Dev_Bus -> Ser_Elevator_dv.Dev_bus, Dev_Bus -> Ser_AileronL_dv.Dev_bus, Dev_Bus -> Ser_AileronR_dv.Dev_bus, Dev_Bus -> Ser_MotorL_dv.Dev_bus, Dev_Bus -> Ser_MotorR_dv.Dev_bus, Recpt_dv.RC_Output -> Proc_RcptCde_PilotServ.Interrupt_RC_Th.RC_Evt_Input, Recpt_dv.RC_Evt_Output -> Proc_RcptCde_PilotServ.RC_Evt_Input, Cpt_dv.Data_Elev_Output -> Ser_Elevator_dv.Data_Input, Cpt_dv.Data_AilL_Output -> Ser_AileronL_dv.Data_Input, Cpt_dv.Data_AilR_Output -> Ser_AileronR_dv.Data_Input, Cpt_dv.Data_MotorL_Output -> Ser_MotorL_dv.Data_Input, Cpt_dv.Data_MotorR_Output -> Ser_MotorR_dv.Data_Input, Cpt_dv.Data_Rudder_Output -> Ser_Rudder_dv.Data_Input, Proc_RcptCde_PilotServ.Interrupt_Elevator_Th.Data_Output -> Cpt_dv.Data_Elev_Input, Proc_RcptCde_PilotServ.Interrupt_MotorL_Th.Data_Output -> Cpt_dv.Data_MotorL_Input, Proc_RcptCde_PilotServ.Interrupt_MotorR_Th.Data_Output -> Cpt_dv.Data_MotorR_Input, Proc_RcptCde_PilotServ.Interrupt_AileronL_Th.Data_Output -> Cpt_dv.Data_AilL_Input, Proc_RcptCde_PilotServ.Interrupt_AileronR_Th.Data_Output -> Cpt_dv.Data_AilR_Input, Proc_RcptCde_PilotServ.Interrupt_Rudder_Th.Data_Output -> Cpt_dv.Data_Rudder_Input, Data_Acq_Filt_Th.GPS_Output -> Nav_Th.GPS_Data_Input, Alt_Ctrl_Th.Montee_Desiree_Output -> Climb_Ctrl_Th.Montee_Desiree_Input, Nav_Th.Altitude_Desiree_Output -> Alt_Ctrl_Th.Altitude_Desiree_Input, Send_MCU1_Th.MCU0_Send_Output -> Interrupt_SPI_Th1.Evt_Send_SPI_Input, Send_Grd_Station_Th.Data_Output -> Interrupt_Modem_Th.Data_Input, Interrupt_SPI_Th1.Data_Rec_MCU0_Output -> Interrupt_SPI_Th2.Data_Rec_MCU0_Input, Interrupt_SPI_Th1.Data_Send_SPI_Output -> Interrupt_SPI_Th2.Data_Send_SPI_Input, Mem_Bus -> Proc_0.Mem_Bus, Mem_Bus -> Ram.Mem_Bus, Dev_Bus -> Proc_0.Dev_Bus, Dev_Bus -> P_dv.Dev_Bus, Dev_Bus -> T_dv.Dev_Bus, Dev_Bus -> Compas_dv.Dev_Bus, Dev_Bus -> V_Air_dv.Dev_Bus, Dev_Bus -> Cam_dv.Dev_Bus, Dev_Bus -> Emet_dv.Dev_Bus, Dev_Bus -> GPS_dv.Dev_Bus, Dev_Bus -> IR_dv.Dev_Bus, Modem_Bus -> Emet_dv.Modem_Bus, P_dv.P_Output -> N_S_C_proc.P_Input, T_dv.T_Output -> N_S_C_proc.T_Input, Compas_dv.Compas_Output -> N_S_C_proc.Compas_Input, V_Air_dv.V_Air_Output -> N_S_C_proc.V_Air_Input, Cam_dv.Video_Output -> Emet_dv.Video_Input, GPS_dv.GPS_Output -> N_S_C_proc.Interrupt_GPS_Th.GPS_Input, GPS_dv.Error_Output -> N_S_C_proc.GPS_Evt_Input, N_S_C_proc.Interrupt_Modem_Th.Data_Output -> Emet_dv.Trans_Data_Input, SPI_Bus -> autopilot.SPI_Con, SPI_Bus -> fly_by_wire.SPI_Con, fly_by_wire.Proc_RcptCde_PilotServ.Interrupt_SPI_1.Data_Send_SPI_Output -> autopilot.N_S_C_proc.Interrupt_SPI_Th1.Evt_Rec_SPI_Input, autopilot.N_S_C_proc.Interrupt_SPI_Th2.Data_Send_SPI_Output -> fly_by_wire.Proc_RcptCde_PilotServ.Interrupt_SPI_1.Evt_Rec_SPI_Input"
