Model,Cluster,Component,Feature
collision_detection_aadl_complete_car_system_complete_car_impl_1,39,"avoider, vehicle_bus, bus_driver, event_distributor, vehicle_memory, avoidance_process_A, motion_data_handler, debris_data_handler, speed_data_handler, vehicle_data_handler, tire_data_handler, conditions_data_handler, driver_data_handler, external_data_handler, avoid_collision_control, safe_impact_control, watchdog_thread, avoidance_process_B, motion_data_handler, debris_data_handler, speed_data_handler, vehicle_data_handler, tire_data_handler, conditions_data_handler, driver_data_handler, external_data_handler, avoid_collision_control, safe_impact_control, watchdog_thread, watchdog_process, vehicle_processor, predictor, vehicle_bus, gps_sensor, magnetic_speedometer, frontal_obstacle_lidar, rear_obstacle_lidar, frontal_vehicle_c2c_sensor, rear_vehicle_c2c_sensor, side_vehicle_c2c_sensor, brake_depth_sensor, tire_pressure_sensor, tire_tread_sensor, wheel_slippage_sensor, road_conditions_sensor, visibility_sensor, driver_responsiveness_sensor, driver_impairment_sensor, vehicle_memory, motion_predictor, data_collector, data_processor, collision_classifier, vehicle_predictor, data_collector, data_processor, collision_classifier, obstacle_predictor, data_collector, data_processor, collision_classifier, speed_predictor, data_collector, data_processor, collision_classifier, tire_predictor, data_collector, data_processor, collision_classifier, conditions_predictor, data_collector, data_processor, collision_classifier, driver_predictor, data_collector, data_processor, collision_classifier, external_message_predictor, data_collector, data_processor, collision_classifier, vehicle_processor, networker, vehicle_bus, shortwave_receiver, cellular_receiver, shortwave_sender, cellular_sender, bus_driver, event_distributor, vehicle_memory, receiver, shortwave_receiver, cellular_receiver, sender, shortwave_sender, cellular_sender, vehicle_processor, responder, external_message_controller, collision_event_handler, crash_data, response_control, broadcast_tester, driver_controller, collision_event_handler, crash_data, response_control, broadcast_tester, emergency_controller, collision_event_handler, crash_data, response_control, broadcast_tester, user_interaction, vehicle_bus, microphone, speaker, system_spoken_to, vehicle_memory, speaker_controller, audio_player, microphone_controller, microphone_sensor, microphone, vehicle_processor, vehicle_actuation, vehicle_bus, front_brakes, rear_brakes, accelerator, driver_seatbelt, passenger_seatbelt, driver_headrest, passenger_headrest, driver_seat, passenger_seat, airbag, driver_nudger, passenger_nudger, wheel_turner, vehicle_memory, speed_actuator, command_received, command_processor, position_actuator, command_received, command_processor, airbag_actuator, command_received, command_processor, direction_actuator, command_received, command_processor, vehicle_processor","condition_nominal, condition_1, condition_2, condition_3, motion_unavoidable_port, motion_avoidable_port, debris_unavoidable_port, debris_avoidable_port, speed_unavoidable_port, speed_avoidable_port, vehicle_unavoidable_port, vehicle_avoidable_port, tire_unavoidable_port, tire_avoidable_port, conditions_unavoidable_port, conditions_avoidable_port, driver_unavoidable_port, driver_avoidable_port, external_unavoidable_port, external_avoidable_port, braking_cmd, steering_cmd, event_data, ba, event_data, ba, ba, sensor_data, vehicle_control_data, motion_unavoidable_port, motion_avoidable_port, debris_unavoidable_port, debris_avoidable_port, speed_unavoidable_port, speed_avoidable_port, vehicle_unavoidable_port, vehicle_avoidable_port, tire_unavoidable_port, tire_avoidable_port, conditions_unavoidable_port, conditions_avoidable_port, driver_unavoidable_port, driver_avoidable_port, external_unavoidable_port, external_avoidable_port, vehicle_event_output, self_test_result, proc_watchdog_cmd_input, send_proc_data, read_sensor, send_proc_data, read_sensor, send_proc_data, read_sensor, send_proc_data, read_sensor, send_proc_data, read_sensor, send_proc_data, read_sensor, send_proc_data, read_sensor, send_proc_data, read_sensor, predictor_cmd, read_proc_data, send_steering_cmds, send_brake_cmds, predictor_cmd, read_proc_data, send_steering_cmds, send_brake_cmds, thread_monitor, failure_detected, all_green, sensor_data, vehicle_control_data, motion_unavoidable_port, motion_avoidable_port, debris_unavoidable_port, debris_avoidable_port, speed_unavoidable_port, speed_avoidable_port, vehicle_unavoidable_port, vehicle_avoidable_port, tire_unavoidable_port, tire_avoidable_port, conditions_unavoidable_port, conditions_avoidable_port, driver_unavoidable_port, driver_avoidable_port, external_unavoidable_port, external_avoidable_port, vehicle_event_output, self_test_result, proc_watchdog_cmd_input, send_proc_data, read_sensor, send_proc_data, read_sensor, send_proc_data, read_sensor, send_proc_data, read_sensor, send_proc_data, read_sensor, send_proc_data, read_sensor, send_proc_data, read_sensor, send_proc_data, read_sensor, predictor_cmd, read_proc_data, send_steering_cmds, send_brake_cmds, predictor_cmd, read_proc_data, send_steering_cmds, send_brake_cmds, thread_monitor, failure_detected, all_green, proc_monitor, hot_swap, BA1, external_message, external_message_unavoidable, external_message_avoidable, motion_detector_unavoidable, motion_detector_avoidable, obstacle_detector_unavoidable, obstacle_detector_avoidable, speed_detector_unavoidable, speed_detector_avoidable, vehicle_detector_unavoidable, vehicle_detector_avoidable, tire_detector_unavoidable, tire_detector_avoidable, conditions_detector_unavoidable, conditions_detector_avoidable, driver_detector_unavoidable, driver_detector_avoidable, false_positive, sensor_data, ba, sensor_data, ba, sensor_data, ba, sensor_data, ba, sensor_data, ba, sensor_data, ba, sensor_data, ba, sensor_data, ba, sensor_data, ba, sensor_data, ba, sensor_data, ba, sensor_data, ba, sensor_data, ba, sensor_data, ba, sensor_data, ba, ba, sensor_output, avoidable_collision_detected, unavoidable_collision_detected, false_positive, sensor_data, raw_data, processed_data, collision_likely, collision_unlikely, collision_data, false_positive, avoidable_collision_detected, unavoidable_collision_detected, sensor_output, avoidable_collision_detected, unavoidable_collision_detected, false_positive, sensor_data, raw_data, processed_data, collision_likely, collision_unlikely, collision_data, false_positive, avoidable_collision_detected, unavoidable_collision_detected, sensor_output, avoidable_collision_detected, unavoidable_collision_detected, false_positive, sensor_data, raw_data, processed_data, collision_likely, collision_unlikely, collision_data, false_positive, avoidable_collision_detected, unavoidable_collision_detected, sensor_output, avoidable_collision_detected, unavoidable_collision_detected, false_positive, sensor_data, raw_data, processed_data, collision_likely, collision_unlikely, collision_data, false_positive, avoidable_collision_detected, unavoidable_collision_detected, sensor_output, avoidable_collision_detected, unavoidable_collision_detected, false_positive, sensor_data, raw_data, processed_data, collision_likely, collision_unlikely, collision_data, false_positive, avoidable_collision_detected, unavoidable_collision_detected, sensor_output, avoidable_collision_detected, unavoidable_collision_detected, false_positive, sensor_data, raw_data, processed_data, collision_likely, collision_unlikely, collision_data, false_positive, avoidable_collision_detected, unavoidable_collision_detected, sensor_output, avoidable_collision_detected, unavoidable_collision_detected, false_positive, sensor_data, raw_data, processed_data, collision_likely, collision_unlikely, collision_data, false_positive, avoidable_collision_detected, unavoidable_collision_detected, sensor_output, avoidable_collision_detected, unavoidable_collision_detected, false_positive, sensor_data, raw_data, processed_data, collision_likely, collision_unlikely, collision_data, false_positive, avoidable_collision_detected, unavoidable_collision_detected, BA1, received_message, message_to_send, received_broadcast, ba, received_broadcast, ba, broadcast, ba, broadcast, ba, event_data, ba, event_data, ba, ba, received_message, message_to_send, received_data, message, received_data, message, received_message, message_to_send, message, message_data, message, message_data, BA1, external_message_unavoidable, external_message_avoidable, emergency_message, driver_alert_message, sensor_data, vehicle_control_data, predictor_input, network_control_event, broad_fail, broad_success, broad_test, read_unavoidable, read_avoidable, send_emergency_message, send_driver_alert, read_vehicle_sensors, send_proc_data, read_proc_data, send_driver_alert, send_emergency_message, predict_cmd, emergency_broad_test, emergency_broad_success, emergency_broad_fail, sensor_data, vehicle_control_data, predictor_input, network_control_event, broad_fail, broad_success, broad_test, read_unavoidable, read_avoidable, send_emergency_message, send_driver_alert, read_vehicle_sensors, send_proc_data, read_proc_data, send_driver_alert, send_emergency_message, predict_cmd, emergency_broad_test, emergency_broad_success, emergency_broad_fail, sensor_data, vehicle_control_data, predictor_input, network_control_event, broad_fail, broad_success, broad_test, read_unavoidable, read_avoidable, send_emergency_message, send_driver_alert, read_vehicle_sensors, send_proc_data, read_proc_data, send_driver_alert, send_emergency_message, predict_cmd, emergency_broad_test, emergency_broad_success, emergency_broad_fail, message_received_from_user, message_to_send_to_user, spoken_command, ba, audio, ba, sensor_data, ba, ba, message, audio, text, audio, text, sensor_ready, audio_available, audio, text, BA1, speed_command, position_command, airbag_command, direction_command, engage, disengage, ba, engage, disengage, ba, engage, disengage, ba, engage, disengage, ba, engage, disengage, ba, engage, disengage, ba, engage, disengage, ba, engage, disengage, ba, engage, disengage, ba, engage, disengage, ba, engage, disengage, ba, engage, disengage, ba, engage, disengage, ba, ba, command_data, engage, disengage, processed_command, received_command, command_data, engage, disengage, command_data, engage, disengage, processed_command, received_command, command_data, engage, disengage, command_data, engage, disengage, processed_command, received_command, command_data, engage, disengage, command_data, engage, disengage, processed_command, received_command, command_data, engage, disengage, BA1"
collision_detection_aadl_networking_subsystem_networking_subsystem_standard_1,40,"vehicle_bus, shortwave_receiver, cellular_receiver, shortwave_sender, cellular_sender, bus_driver, event_distributor, vehicle_memory, receiver, shortwave_receiver, cellular_receiver, sender, shortwave_sender, cellular_sender, vehicle_processor","received_message, message_to_send, received_broadcast, ba, received_broadcast, ba, broadcast, ba, broadcast, ba, event_data, ba, event_data, ba, ba, received_message, message_to_send, received_data, message, received_data, message, received_message, message_to_send, message, message_data, message, message_data, BA1"
collision_detection_aadl_prediction_subsystem_prediction_subsystem_standard_1,39,"vehicle_bus, gps_sensor, magnetic_speedometer, frontal_obstacle_lidar, rear_obstacle_lidar, frontal_vehicle_c2c_sensor, rear_vehicle_c2c_sensor, side_vehicle_c2c_sensor, brake_depth_sensor, tire_pressure_sensor, tire_tread_sensor, wheel_slippage_sensor, road_conditions_sensor, visibility_sensor, driver_responsiveness_sensor, driver_impairment_sensor, vehicle_memory, motion_predictor, data_collector, data_processor, collision_classifier, vehicle_predictor, data_collector, data_processor, collision_classifier, obstacle_predictor, data_collector, data_processor, collision_classifier, speed_predictor, data_collector, data_processor, collision_classifier, tire_predictor, data_collector, data_processor, collision_classifier, conditions_predictor, data_collector, data_processor, collision_classifier, driver_predictor, data_collector, data_processor, collision_classifier, external_message_predictor, data_collector, data_processor, collision_classifier, vehicle_processor","external_message, external_message_unavoidable, external_message_avoidable, motion_detector_unavoidable, motion_detector_avoidable, obstacle_detector_unavoidable, obstacle_detector_avoidable, speed_detector_unavoidable, speed_detector_avoidable, vehicle_detector_unavoidable, vehicle_detector_avoidable, tire_detector_unavoidable, tire_detector_avoidable, conditions_detector_unavoidable, conditions_detector_avoidable, driver_detector_unavoidable, driver_detector_avoidable, false_positive, sensor_data, ba, sensor_data, ba, sensor_data, ba, sensor_data, ba, sensor_data, ba, sensor_data, ba, sensor_data, ba, sensor_data, ba, sensor_data, ba, sensor_data, ba, sensor_data, ba, sensor_data, ba, sensor_data, ba, sensor_data, ba, sensor_data, ba, ba, sensor_output, avoidable_collision_detected, unavoidable_collision_detected, false_positive, sensor_data, raw_data, processed_data, collision_likely, collision_unlikely, collision_data, false_positive, avoidable_collision_detected, unavoidable_collision_detected, sensor_output, avoidable_collision_detected, unavoidable_collision_detected, false_positive, sensor_data, raw_data, processed_data, collision_likely, collision_unlikely, collision_data, false_positive, avoidable_collision_detected, unavoidable_collision_detected, sensor_output, avoidable_collision_detected, unavoidable_collision_detected, false_positive, sensor_data, raw_data, processed_data, collision_likely, collision_unlikely, collision_data, false_positive, avoidable_collision_detected, unavoidable_collision_detected, sensor_output, avoidable_collision_detected, unavoidable_collision_detected, false_positive, sensor_data, raw_data, processed_data, collision_likely, collision_unlikely, collision_data, false_positive, avoidable_collision_detected, unavoidable_collision_detected, sensor_output, avoidable_collision_detected, unavoidable_collision_detected, false_positive, sensor_data, raw_data, processed_data, collision_likely, collision_unlikely, collision_data, false_positive, avoidable_collision_detected, unavoidable_collision_detected, sensor_output, avoidable_collision_detected, unavoidable_collision_detected, false_positive, sensor_data, raw_data, processed_data, collision_likely, collision_unlikely, collision_data, false_positive, avoidable_collision_detected, unavoidable_collision_detected, sensor_output, avoidable_collision_detected, unavoidable_collision_detected, false_positive, sensor_data, raw_data, processed_data, collision_likely, collision_unlikely, collision_data, false_positive, avoidable_collision_detected, unavoidable_collision_detected, sensor_output, avoidable_collision_detected, unavoidable_collision_detected, false_positive, sensor_data, raw_data, processed_data, collision_likely, collision_unlikely, collision_data, false_positive, avoidable_collision_detected, unavoidable_collision_detected, BA1"
collision_detection_aadl_response_subsystem_response_subsystem_standard_1,17,"external_message_controller, collision_event_handler, crash_data, response_control, broadcast_tester, driver_controller, collision_event_handler, crash_data, response_control, broadcast_tester, emergency_controller, collision_event_handler, crash_data, response_control, broadcast_tester","external_message_unavoidable, external_message_avoidable, emergency_message, driver_alert_message, sensor_data, vehicle_control_data, predictor_input, network_control_event, broad_fail, broad_success, broad_test, read_unavoidable, read_avoidable, send_emergency_message, send_driver_alert, read_vehicle_sensors, send_proc_data, read_proc_data, send_driver_alert, send_emergency_message, predict_cmd, emergency_broad_test, emergency_broad_success, emergency_broad_fail, sensor_data, vehicle_control_data, predictor_input, network_control_event, broad_fail, broad_success, broad_test, read_unavoidable, read_avoidable, send_emergency_message, send_driver_alert, read_vehicle_sensors, send_proc_data, read_proc_data, send_driver_alert, send_emergency_message, predict_cmd, emergency_broad_test, emergency_broad_success, emergency_broad_fail, sensor_data, vehicle_control_data, predictor_input, network_control_event, broad_fail, broad_success, broad_test, read_unavoidable, read_avoidable, send_emergency_message, send_driver_alert, read_vehicle_sensors, send_proc_data, read_proc_data, send_driver_alert, send_emergency_message, predict_cmd, emergency_broad_test, emergency_broad_success, emergency_broad_fail"
collision_detection_aadl_user_interaction_subsystem_user_interaction_subsystem_standard_1,40,"vehicle_bus, microphone, speaker, system_spoken_to, vehicle_memory, speaker_controller, audio_player, microphone_controller, microphone_sensor, microphone, vehicle_processor","message_received_from_user, message_to_send_to_user, spoken_command, ba, audio, ba, sensor_data, ba, ba, message, audio, text, audio, text, sensor_ready, audio_available, audio, text, BA1"
collision_detection_aadl_vehicle_actuation_vehicle_actuation_standard_1,43,"vehicle_bus, front_brakes, rear_brakes, accelerator, driver_seatbelt, passenger_seatbelt, driver_headrest, passenger_headrest, driver_seat, passenger_seat, airbag, driver_nudger, passenger_nudger, wheel_turner, vehicle_memory, speed_actuator, command_received, command_processor, position_actuator, command_received, command_processor, airbag_actuator, command_received, command_processor, direction_actuator, command_received, command_processor, vehicle_processor","speed_command, position_command, airbag_command, direction_command, engage, disengage, ba, engage, disengage, ba, engage, disengage, ba, engage, disengage, ba, engage, disengage, ba, engage, disengage, ba, engage, disengage, ba, engage, disengage, ba, engage, disengage, ba, engage, disengage, ba, engage, disengage, ba, engage, disengage, ba, engage, disengage, ba, ba, command_data, engage, disengage, processed_command, received_command, command_data, engage, disengage, command_data, engage, disengage, processed_command, received_command, command_data, engage, disengage, command_data, engage, disengage, processed_command, received_command, command_data, engage, disengage, command_data, engage, disengage, processed_command, received_command, command_data, engage, disengage, BA1"
Crazyflie_Crazyflie_Final_Crazyflie_Final_impl_1,19,"Functional, Acc, Gyro, Magneto, Pilot, Fusion, Controller, Motors, Actual, UART, I2C, PWM, MPU9250, M1, M2, M3, M4, STM32F405, nrf51822, nRF51822_Firmware, STM32F405_Firmware, CRTP_Tx_Task, CRTP_Rx_Task, Power_Management, Main_Loop","Accelero_Out, Gyro_Out, Magneto_Out, Order, Accelero_In, Gyro_In, Magneto_In, Data_F_Out, Data_F_In, Gyro_In, Motor_Out, TC, Motor_In, DOF6, i2c_bus, rate, pwm_bus, rate, pwm_bus, rate, pwm_bus, rate, pwm_bus, i2c_bus, spi_bus, uart_bus, pwm_bus, uart_bus, Syslink_Packet_TX, Syslink_Packet_RX, Syslink_Packet_Rx, Syslink_Packet_Tx, DOFs, Rate_1, Rate_2, Rate_3, Rate_4, Msg, Syslink_Packet, Msg, Syslink_Packet, DOFs, Syslink_Packet_Rx, Syslink_Packet_Tx, Rate_1, Rate_2, Rate_3, Rate_4"
Crazyflie_Crazyflie_functional_Crazyflie_Functional_Chain_impl_1,13,"Acc, Gyro, Magneto, Pilot, Fusion, Controller, Motors","Accelero_Out, Gyro_Out, Magneto_Out, Order, Accelero_In, Gyro_In, Magneto_In, Data_F_Out, Data_F_In, Gyro_In, Motor_Out, TC, Motor_In"
Crazyflie_Crazyflie_Hardware_Crazyflie_impl_1,19,"UART, I2C, PWM, MPU9250, M1, M2, M3, M4, STM32F405, nrf51822","DOF6, i2c_bus, rate, pwm_bus, rate, pwm_bus, rate, pwm_bus, rate, pwm_bus, i2c_bus, spi_bus, uart_bus, pwm_bus, uart_bus"
Crazyflie_Crazyflie_System_Crazyflie_System_impl_1,40,"UART, I2C, PWM, MPU9250, M1, M2, M3, M4, STM32F405, nrf51822, nRF51822_Firmware, STM32F405_Firmware, CRTP_Tx_Task, CRTP_Rx_Task, Power_Management, Main_Loop","DOF6, i2c_bus, rate, pwm_bus, rate, pwm_bus, rate, pwm_bus, rate, pwm_bus, i2c_bus, spi_bus, uart_bus, pwm_bus, uart_bus, Syslink_Packet_TX, Syslink_Packet_RX, Syslink_Packet_Rx, Syslink_Packet_Tx, DOFs, Rate_1, Rate_2, Rate_3, Rate_4, Msg, Syslink_Packet, Msg, Syslink_Packet, DOFs, Syslink_Packet_Rx, Syslink_Packet_Tx, Rate_1, Rate_2, Rate_3, Rate_4"
CSCI445-Adventium-Labs-GUMBO-Plugin-2021_Pressure_Ctrl_Pressure_Ctrl_impl_1,7,pressure_sensor,"env_pressure, shutdown, pressure, high_indicator"
CSCI445-Adventium-Labs-GUMBO-Plugin-2021_Pressure_Ctrl_Pressure_Ctrl_impl_2,7,pressure_sensor,"env_pressure, shutdown, pressure, high_indicator"
CSCI445-Adventium-Labs-GUMBO-Plugin-2021_Radiation_Ctrl_Radiation_Ctrl_impl_1,7,radiation_sensor,"env_radiation, shutdown, radiation, high_indicator"
CSCI445-Adventium-Labs-GUMBO-Plugin-2021_Radiation_Ctrl_Radiation_Ctrl_impl_2,7,radiation_sensor,"env_radiation, shutdown, radiation, high_indicator"
CSCI445-Adventium-Labs-GUMBO-Plugin-2021_Sensor_System_SensorSys_impl_1,7,"radiation, radiation_sensor, pressure, pressure_sensor, temp, temp_sensor","env_radiation, env_pressure, env_temperature, shutdown, env_radiation, shutdown, radiation, high_indicator, env_pressure, shutdown, pressure, high_indicator, env_temperature, shutdown, temperature, high_indicator"
CSCI445-Adventium-Labs-GUMBO-Plugin-2021_Sensor_System_SensorSys_impl_2,7,"radiation, radiation_sensor, pressure, pressure_sensor, temp, temp_sensor","env_radiation, env_pressure, env_temperature, shutdown, env_radiation, shutdown, radiation, high_indicator, env_pressure, shutdown, pressure, high_indicator, env_temperature, shutdown, temperature, high_indicator"
CSCI445-Adventium-Labs-GUMBO-Plugin-2021_Temperature_Ctrl_Temperature_Ctrl_impl_1,7,temp_sensor,"env_temperature, shutdown, temperature, high_indicator"
CSCI445-Adventium-Labs-GUMBO-Plugin-2021_Temperature_Ctrl_Temperature_Ctrl_impl_2,7,temp_sensor,"env_temperature, shutdown, temperature, high_indicator"
DAPP_aadl_integration_integration_generic_1,16,"frontend_application, backend_application, mobile_application, dapp_application, hyperledger_besu, alchemy","connection_port, backend_port, connection_port, dapp_port, backend_port, connection_port, etherium_rpc_port, node_provider_port, connection_port, connection_port"
DAPP_aadl_integration_integration_write_owner_request_impl_1,16,"frontend_application, backend_application, mobile_application, dapp_application, hyperledger_besu, alchemy","connection_port, backend_port, connection_port, dapp_port, backend_port, connection_port, etherium_rpc_port, node_provider_port, connection_port, connection_port"
DHsystem_Accounts_DHaccounts_impl_1,17,"Authentication, AccountSettings, AccessControl","web_acc, br_acc, config_acc, webOUT_au, brOUT_au, au, au_as, ac_as, config_ac, ac"
DHsystem_Communications_DHcommunications_impl_1,17,"Acquisitor, CommunicationManager, DHgateway, tempController, humController, powerController, applController, secController","comm_device, pm_comm, config_comm, cm_aq, config_cm, pmOUT_cm, cm_aq, cm_gateway, cm_gateway, gateway_device"
DHsystem_Communications_DHgateway_impl_1,17,"tempController, humController, powerController, applController, secController","cm_gateway, gateway_device"
DHsystem_Configurations_DHconfig_impl_1,40,"ProgrammableThermostat, ProgrammableApplianceManager, SecuritySystem, ProgrammableHumidistat, Planner, ConfigurationManager, Report","config_acc, config_cm, web_config, br_config, pm_config, plan_tp, cm_tp, rep_tp, plan_apm, cm_apm, rep_apm, plan_ss, cm_ss, rep_ss, plan_hp, cm_hp, rep_hp, plan_tp, plan_apm, plan_ss, plan_hp, cm_plan, cm_tp, cm_plan, cm_ss, cm_outCM, cm_outACC, cm_hp, cm_rep, cm_apm, webOUT_cm, brOUT_cm, pmOUT_cm, rep_apm, rep_tp, rep_ss, rep_hp, cm_rep"
DHsystem_Devices_DHdevices_impl_1,40,"DeviceManager, HumidityDevices, Humidifier, Dehumidifier, HumiditySensor, PowerDevices, Switch, Appliances, Lights, SecurityDevices, Alarms, DoorSensor, WindowSensor, ThermostatDevices, HVAC, ThermostatSensort","device_se, pm_device, comm_device, dm_hum, dm_pow, dm_sec, dm_thermo, dm_seOUT, gatewayOUT_dm, pmOUT_dm, dm_hum, hum_sensor, dh_sensor, hum_sensor, dh_sensor, dm_pow, sw_app, sw_light, sw_app, sw_light, dm_sec, al_door, al_win, al_door, al_win, dm_thermo, hvac_ts, hvac_ts"
DHsystem_Devices_humidity_impl_1,40,"Humidifier, Dehumidifier, HumiditySensor","dm_hum, hum_sensor, dh_sensor, hum_sensor, dh_sensor"
DHsystem_Devices_power_impl_1,40,"Switch, Appliances, Lights","dm_pow, sw_app, sw_light, sw_app, sw_light"
DHsystem_Devices_security_impl_1,40,"Alarms, DoorSensor, WindowSensor","dm_sec, al_door, al_win, al_door, al_win"
DHsystem_Devices_thermo_impl_1,40,"HVAC, ThermostatSensort","dm_thermo, hvac_ts, hvac_ts"
