Model,Cluster,Component,Feature
APS-Communication_Architecture_APS_APSCommunication_impl_1,27,"this_InternetModule, this_RCCAPSModule, this_TrafficModule, EmergencyControlModule, this_Switch_Main_CoreCommunication, this_Switch_Backup_CoreCommunication, PrimaryWANLoadBalancer, SecondaryWANLoadBalancer, this_ASC, ASC_Main, COLAVandSSITAW_Main, ASC_Process, ASC_IDS, ASC_Discover, ASC_CDA, ASC_CP, ASC_CAM, ASC_MV, ASC_SS, ASC_VM, ASC_DK, NICTeaming, NetworkAndSystemManagement_Main, NICTeaming, UAM, ConnectivityManager_Process, NI, TPC, TRC, QoSC, NMT, NSU, NSM, NSC, NDBC, DigitalLogbook, IS3MS_Main, NICTeaming, SIEM, ASC_Backup, COLAVandSSITAW_Backup, ASC_Process, ASC_IDS, ASC_Discover, ASC_CDA, ASC_CP, ASC_CAM, ASC_MV, ASC_SS, ASC_VM, ASC_DK, NICTeaming, NetworkAndSystemManagement_Backup, NICTeaming, UAM, ConnectivityManager_Process, NI, TPC, TRC, QoSC, NMT, NSU, NSM, NSC, NDBC, DigitalLogbook, IS3MS_Backup, NICTeaming, SIEM, this_MachinerySystem, this_IOCard1, this_IOCard2, this_AzimuthThruster1, this_AzimuthThruster2, this_AzimuthThruster3, this_AzimuthThruster4, this_NavigationSystem, this_Lidar1, this_Lidar2, this_Radar1, this_Radar2, this_Radar3, this_EO1, this_EO2, this_EO3, this_DomeCamera1, this_IRCamera1, this_SPU1, this_SPU2, this_SPU3, this_Radar5, this_SPU5, this_SPU4, this_EO4, this_Lidar4, this_Lidar3, this_EO5, this_Radar4, this_SenseorSwitch, this_GNSS_IMU_Main, GNSS_Security, GNSS_IDS, this_RTK_UHF, this_GNSSReceiver1, this_SenseorSwitch_Backup, this_GNSSReceiver2, this_GNSS_IMU_Backup, GNSS_Security, GNSS_IDS, this_SafetySystem, this_GeneralIOModule1, this_UserPanel1, this_Alarm1, this_Lantern1, this_AnchorDrop1, this_Horn1, this_BMS, this_EmergencyButtonTransmitter, this_EPB, this_EmergencyCommunicationModule, IDS1, IDS2","InternetAccess, AISCommunication, RCCCommunication, RadioCommunication, UHFPositionCorrection, GNSSSignal, MobileCommunication, UplinkDownlinkPort, ManagementPort, eth1, eth2, ControlPort, eth1, eth2, WirelessPort, ControlPort, DataPort, NavDataPort, GNSSSignal, ControlPort, eth1, eth2, eth3, eth4, WirelessPort, eth1, eth2, eth3, eth4, eth5, eth6, eth7, eth8, eth9, eth10, eth11, eth12, eth13, eth14, eth15, eth16, eth17, eth18, eth19, eth20, RedundancyPort, eth1, eth2, eth3, eth4, eth5, eth6, eth7, eth8, eth9, eth10, eth11, eth12, eth13, eth14, eth15, eth16, eth17, eth18, eth19, eth20, RedundancyPort, PrimaryWAN, SecondaryWAN, eth1, eth2, eth3, eth4, eth5, eth6, eth7, eth8, RedundancyPort, PrimaryWAN, SecondaryWAN, eth1, eth2, eth3, eth4, eth5, eth6, eth7, eth8, RedundancyPort, COLAVandSSITAW_Main1, COLAVandSSITAW_Main2, COLAVandSSITAW_Backup1, COLAVandSSITAW_Backup2, EC, NSM_Main1, NSM_Main2, NSM_Backup1, NSM_Backup2, IS3MS_Main1, IS3MS_Main2, IS3MS_Backup1, IS3MS_Backup2, COLAVandSSITAW_Main_Primary, COLAVandSSITAW_Main_Secondary, NetworkAndSystemManagement_Main_Primary, NetworkAndSystemManagement_Main_Secondary, IS3MS_Main_Primar, IS3MS_Main_Secondary, eth1, eth2, Dataport, EmergencyDataPort, DataPort, MainDataPort, MainDataPort, BackupDataPort, MainDataPort, BackupDataPort, MainDataPort, MainDataPort, BackupDataPort, MainDataPort, MainDataPort, MainDataPort, Veth1, Veth2, Teamedeth, eth1, eth2, Veth1, Veth2, Teamedeth, DataPort, DataPort, Dataport, et1, et2, Veth1, Veth2, Teamedeth, DataPort, COLAVandSSITAW_Backup_Primary, COLAVandSSITAW_Backup_Secondary, NetworkAndSystemManagement_Backup_Primary, NetworkAndSystemManagement_Backup_Secondary, IS3MS_Backup_Primar, IS3MS_Backup_Secondary, EmergencyControlPort, eth1, eth2, EmergencyPort, Dataport, EmergencyDataPort, DataPort, MainDataPort, MainDataPort, BackupDataPort, MainDataPort, BackupDataPort, MainDataPort, MainDataPort, BackupDataPort, MainDataPort, MainDataPort, MainDataPort, Veth1, Veth2, Teamedeth, eth1, eth2, Veth1, Veth2, Teamedeth, DataPort, DataPort, Dataport, et1, et2, Veth1, Veth2, Teamedeth, DataPort, MainDataPort1, MainDataPort2, BackupDataPort1, BackupDataPort2, SignalPort1, SignalPort2, eth1, eth2, SignalPort1, SignalPort2, eth1, eth2, SignalPort, SignalPort, SignalPort, SignalPort, MainDataPort1, MainDataPort2, MainDataPort3, MainDataPort4, BackupDataPort1, BackupDataPort2, BackupDataPort3, BackupDataPort4, PositionCorrectionPort, GNSSSignal, ControlPort, DataPort, ControlPort, DataPort, ControlPort, DataPort, ControlPort, DataPort, ControlPort, DataPort, ControlPort, DataPort, ControlPort, DataPort, ControlPort, DataPort, ControlPort, DataPort, ControlPort, DataPort, eth1, eth2, eth3, eth4, eth5, eth6, eth1, eth2, eth3, eth4, eth5, eth6, eth1, eth2, eth3, eth4, eth5, eth6, ControlPort, DataPort, eth1, eth2, eth3, eth4, eth5, eth6, eth1, eth2, eth3, eth4, eth5, eth6, ControlPort, DataPort, ControlPort, DataPort, ControlPort, DataPort, ControlPort, DataPort, ControlPort, DataPort, eth1, eth2, eth3, eth4, eth5, eth6, eth7, eth8, RTK_UHF_DataIn, GNSSSignalIn, eth1, eth2, DataPort, DataPort, DataOut, PositionCorrectionData, DataPort, Incoming, eth1, eth2, eth3, eth4, eth5, eth6, eth7, eth8, DataPort, Incoming, RTK_UHF_DataIn, GNSSSignalIn, eth1, eth2, DataPort, DataPort, MainDataPort, BackupDataPort, Input1, Output1, Output2, Output3, Output4, eth1, eth2, Output, Input, Input, Input, Input, MainDataPort, BackupDataPort, EmergencySignal, ButtonPressed, EmergencySignalIn, EmergencySignalOut, eth1, eth2, eth1, eth2"
APS-Communication_Architecture_APS_ASC_Backup_impl_1,4,"COLAVandSSITAW_Backup, ASC_Process, ASC_IDS, ASC_Discover, ASC_CDA, ASC_CP, ASC_CAM, ASC_MV, ASC_SS, ASC_VM, ASC_DK, NICTeaming, NetworkAndSystemManagement_Backup, NICTeaming, UAM, ConnectivityManager_Process, NI, TPC, TRC, QoSC, NMT, NSU, NSM, NSC, NDBC, DigitalLogbook, IS3MS_Backup, NICTeaming, SIEM","COLAVandSSITAW_Backup_Primary, COLAVandSSITAW_Backup_Secondary, NetworkAndSystemManagement_Backup_Primary, NetworkAndSystemManagement_Backup_Secondary, IS3MS_Backup_Primar, IS3MS_Backup_Secondary, EmergencyControlPort, eth1, eth2, EmergencyPort, Dataport, EmergencyDataPort, DataPort, MainDataPort, MainDataPort, BackupDataPort, MainDataPort, BackupDataPort, MainDataPort, MainDataPort, BackupDataPort, MainDataPort, MainDataPort, MainDataPort, Veth1, Veth2, Teamedeth, eth1, eth2, Veth1, Veth2, Teamedeth, DataPort, DataPort, Dataport, et1, et2, Veth1, Veth2, Teamedeth, DataPort"
APS-Communication_Architecture_APS_ASC_impl_1,26,"ASC_Main, COLAVandSSITAW_Main, ASC_Process, ASC_IDS, ASC_Discover, ASC_CDA, ASC_CP, ASC_CAM, ASC_MV, ASC_SS, ASC_VM, ASC_DK, NICTeaming, NetworkAndSystemManagement_Main, NICTeaming, UAM, ConnectivityManager_Process, NI, TPC, TRC, QoSC, NMT, NSU, NSM, NSC, NDBC, DigitalLogbook, IS3MS_Main, NICTeaming, SIEM, ASC_Backup, COLAVandSSITAW_Backup, ASC_Process, ASC_IDS, ASC_Discover, ASC_CDA, ASC_CP, ASC_CAM, ASC_MV, ASC_SS, ASC_VM, ASC_DK, NICTeaming, NetworkAndSystemManagement_Backup, NICTeaming, UAM, ConnectivityManager_Process, NI, TPC, TRC, QoSC, NMT, NSU, NSM, NSC, NDBC, DigitalLogbook, IS3MS_Backup, NICTeaming, SIEM","COLAVandSSITAW_Main1, COLAVandSSITAW_Main2, COLAVandSSITAW_Backup1, COLAVandSSITAW_Backup2, EC, NSM_Main1, NSM_Main2, NSM_Backup1, NSM_Backup2, IS3MS_Main1, IS3MS_Main2, IS3MS_Backup1, IS3MS_Backup2, COLAVandSSITAW_Main_Primary, COLAVandSSITAW_Main_Secondary, NetworkAndSystemManagement_Main_Primary, NetworkAndSystemManagement_Main_Secondary, IS3MS_Main_Primar, IS3MS_Main_Secondary, eth1, eth2, Dataport, EmergencyDataPort, DataPort, MainDataPort, MainDataPort, BackupDataPort, MainDataPort, BackupDataPort, MainDataPort, MainDataPort, BackupDataPort, MainDataPort, MainDataPort, MainDataPort, Veth1, Veth2, Teamedeth, eth1, eth2, Veth1, Veth2, Teamedeth, DataPort, DataPort, Dataport, et1, et2, Veth1, Veth2, Teamedeth, DataPort, COLAVandSSITAW_Backup_Primary, COLAVandSSITAW_Backup_Secondary, NetworkAndSystemManagement_Backup_Primary, NetworkAndSystemManagement_Backup_Secondary, IS3MS_Backup_Primar, IS3MS_Backup_Secondary, EmergencyControlPort, eth1, eth2, EmergencyPort, Dataport, EmergencyDataPort, DataPort, MainDataPort, MainDataPort, BackupDataPort, MainDataPort, BackupDataPort, MainDataPort, MainDataPort, BackupDataPort, MainDataPort, MainDataPort, MainDataPort, Veth1, Veth2, Teamedeth, eth1, eth2, Veth1, Veth2, Teamedeth, DataPort, DataPort, Dataport, et1, et2, Veth1, Veth2, Teamedeth, DataPort"
APS-Communication_Architecture_APS_ASC_Main_impl_1,26,"COLAVandSSITAW_Main, ASC_Process, ASC_IDS, ASC_Discover, ASC_CDA, ASC_CP, ASC_CAM, ASC_MV, ASC_SS, ASC_VM, ASC_DK, NICTeaming, NetworkAndSystemManagement_Main, NICTeaming, UAM, ConnectivityManager_Process, NI, TPC, TRC, QoSC, NMT, NSU, NSM, NSC, NDBC, DigitalLogbook, IS3MS_Main, NICTeaming, SIEM","COLAVandSSITAW_Main_Primary, COLAVandSSITAW_Main_Secondary, NetworkAndSystemManagement_Main_Primary, NetworkAndSystemManagement_Main_Secondary, IS3MS_Main_Primar, IS3MS_Main_Secondary, eth1, eth2, Dataport, EmergencyDataPort, DataPort, MainDataPort, MainDataPort, BackupDataPort, MainDataPort, BackupDataPort, MainDataPort, MainDataPort, BackupDataPort, MainDataPort, MainDataPort, MainDataPort, Veth1, Veth2, Teamedeth, eth1, eth2, Veth1, Veth2, Teamedeth, DataPort, DataPort, Dataport, et1, et2, Veth1, Veth2, Teamedeth, DataPort"
APS-Communication_Architecture_APS_COLAVandSSITAW_Backup_impl_1,4,"ASC_Process, ASC_IDS, ASC_Discover, ASC_CDA, ASC_CP, ASC_CAM, ASC_MV, ASC_SS, ASC_VM, ASC_DK, NICTeaming","eth1, eth2, EmergencyPort, Dataport, EmergencyDataPort, DataPort, MainDataPort, MainDataPort, BackupDataPort, MainDataPort, BackupDataPort, MainDataPort, MainDataPort, BackupDataPort, MainDataPort, MainDataPort, MainDataPort, Veth1, Veth2, Teamedeth"
APS-Communication_Architecture_APS_COLAVandSSITAW_impl_1,4,"ASC_Process, ASC_IDS, ASC_Discover, ASC_CDA, ASC_CP, ASC_CAM, ASC_MV, ASC_SS, ASC_VM, ASC_DK, NICTeaming","eth1, eth2, Dataport, EmergencyDataPort, DataPort, MainDataPort, MainDataPort, BackupDataPort, MainDataPort, BackupDataPort, MainDataPort, MainDataPort, BackupDataPort, MainDataPort, MainDataPort, MainDataPort, Veth1, Veth2, Teamedeth"
APS-Communication_Architecture_APS_EmergencyButtonTransmitter_impl_1,9,"this_EPB, this_EmergencyCommunicationModule","EmergencySignal, ButtonPressed, EmergencySignalIn, EmergencySignalOut"
APS-Communication_Architecture_APS_GNSS_IMU_Backup_impl_1,3,"GNSS_Security, GNSS_IDS","RTK_UHF_DataIn, GNSSSignalIn, eth1, eth2, DataPort, DataPort"
APS-Communication_Architecture_APS_GNSS_IMU_Main_impl_1,3,"GNSS_Security, GNSS_IDS","RTK_UHF_DataIn, GNSSSignalIn, eth1, eth2, DataPort, DataPort"
APS-Communication_Architecture_APS_IS3MS_impl_1,26,"NICTeaming, SIEM","et1, et2, Veth1, Veth2, Teamedeth, DataPort"
APS-Communication_Architecture_APS_MachinerySystem_impl_1,40,"this_IOCard1, this_IOCard2, this_AzimuthThruster1, this_AzimuthThruster2, this_AzimuthThruster3, this_AzimuthThruster4","MainDataPort1, MainDataPort2, BackupDataPort1, BackupDataPort2, SignalPort1, SignalPort2, eth1, eth2, SignalPort1, SignalPort2, eth1, eth2, SignalPort, SignalPort, SignalPort, SignalPort"
APS-Communication_Architecture_APS_NavigationSystem_Backup_impl_1,4,"this_RTK_UHF_Backup, this_GNSSReceiver2, this_GNSS_IMU_Backup","MainDataPort, MainDataPort2, BackupDataPort, BackupDataPort2, DataOut, PositionCorrectionData, DataPort, Incoming, RTK_UHF_DataIn, GNSSSignalIn, eth1, eth2"
APS-Communication_Architecture_APS_NavigationSystem_Backup_impl_withRedundancy_1,27,"this_Lidar3, this_Radar4, this_EO4, this_Radar5, this_Lidar4, this_EO5, this_SPU5, this_SPU4, this_RTK_UHF, this_GNSSReceiver2, this_GNSS_IMU_Backup, this_SenseorSwitch_Backup","MainDataPort, MainDataPort2, BackupDataPort, BackupDataPort2, ControlPort, DataPort, ControlPort, DataPort, ControlPort, DataPort, ControlPort, DataPort, ControlPort, DataPort, ControlPort, DataPort, eth1, eth2, eth3, eth4, eth5, eth6, eth1, eth2, eth3, eth4, eth5, eth6, DataOut, PositionCorrectionData, DataPort, Incoming, RTK_UHF_DataIn, GNSSSignalIn, eth1, eth2, eth1, eth2, eth3, eth4, eth5, eth6, eth7, eth8"
APS-Communication_Architecture_APS_NavigationSystem_impl_1,27,"this_Lidar1, this_Lidar2, this_Lidar3, this_Lidar4, this_Radar1, this_Radar2, this_Radar3, this_Radar4, this_Radar5, this_EO1, this_EO2, this_EO3, this_EO4, this_EO5, this_DomeCamera1, this_IRCamera1, this_SPU1, this_SPU2, this_SPU3, this_SPU4, this_SPU5, this_SenseorSwitch, this_GNSS_IMU_Main, this_RTK_UHF, this_GNSSReceiver1","MainDataPort1, MainDataPort2, MainDataPort3, MainDataPort4, BackupDataPort1, BackupDataPort2, BackupDataPort3, BackupDataPort4, PositionCorrectionPort, GNSSSignal, ControlPort, DataPort, ControlPort, DataPort, ControlPort, DataPort, ControlPort, DataPort, ControlPort, DataPort, ControlPort, DataPort, ControlPort, DataPort, ControlPort, DataPort, ControlPort, DataPort, ControlPort, DataPort, ControlPort, DataPort, ControlPort, DataPort, ControlPort, DataPort, ControlPort, DataPort, ControlPort, DataPort, ControlPort, DataPort, eth1, eth2, eth3, eth4, eth5, eth6, eth1, eth2, eth3, eth4, eth5, eth6, eth1, eth2, eth3, eth4, eth5, eth6, eth1, eth2, eth3, eth4, eth5, eth6, eth1, eth2, eth3, eth4, eth5, eth6, eth1, eth2, eth3, eth4, eth5, eth6, eth7, eth8, RTK_UHF_DataIn, GNSSSignalIn, eth1, eth2, DataOut, PositionCorrectionData, DataPort, Incoming"
APS-Communication_Architecture_APS_NavigationSystem_impl_withRedundancy2_1,27,"this_Lidar1, this_Lidar2, this_Radar1, this_Radar2, this_Radar3, this_EO1, this_EO2, this_EO3, this_DomeCamera1, this_IRCamera1, this_SPU1, this_SPU2, this_SPU3, this_Radar5, this_SPU5, this_SPU4, this_EO4, this_Lidar4, this_Lidar3, this_EO5, this_Radar4, this_SenseorSwitch, this_GNSS_IMU_Main, GNSS_Security, GNSS_IDS, this_RTK_UHF, this_GNSSReceiver1, this_SenseorSwitch_Backup, this_GNSSReceiver2, this_GNSS_IMU_Backup, GNSS_Security, GNSS_IDS","MainDataPort1, MainDataPort2, MainDataPort3, MainDataPort4, BackupDataPort1, BackupDataPort2, BackupDataPort3, BackupDataPort4, PositionCorrectionPort, GNSSSignal, ControlPort, DataPort, ControlPort, DataPort, ControlPort, DataPort, ControlPort, DataPort, ControlPort, DataPort, ControlPort, DataPort, ControlPort, DataPort, ControlPort, DataPort, ControlPort, DataPort, ControlPort, DataPort, eth1, eth2, eth3, eth4, eth5, eth6, eth1, eth2, eth3, eth4, eth5, eth6, eth1, eth2, eth3, eth4, eth5, eth6, ControlPort, DataPort, eth1, eth2, eth3, eth4, eth5, eth6, eth1, eth2, eth3, eth4, eth5, eth6, ControlPort, DataPort, ControlPort, DataPort, ControlPort, DataPort, ControlPort, DataPort, ControlPort, DataPort, eth1, eth2, eth3, eth4, eth5, eth6, eth7, eth8, RTK_UHF_DataIn, GNSSSignalIn, eth1, eth2, DataPort, DataPort, DataOut, PositionCorrectionData, DataPort, Incoming, eth1, eth2, eth3, eth4, eth5, eth6, eth7, eth8, DataPort, Incoming, RTK_UHF_DataIn, GNSSSignalIn, eth1, eth2, DataPort, DataPort"
APS-Communication_Architecture_APS_NavigationSystem_impl_withRedundancy_1,27,"this_Lidar1, this_Lidar2, this_Lidar3, this_Lidar4, this_Radar1, this_Radar2, this_Radar3, this_Radar4, this_Radar5, this_EO1, this_EO2, this_EO3, this_EO4, this_EO5, this_DomeCamera1, this_IRCamera1, this_SPU1, this_SPU2, this_SPU3, this_SPU4, this_SPU5, this_SenseorSwitch, this_SenseorSwitch_Backup, this_GNSS_IMU_Main, this_RTK_UHF, this_GNSSReceiver1","MainDataPort1, MainDataPort2, MainDataPort3, MainDataPort4, BackupDataPort1, BackupDataPort2, BackupDataPort3, BackupDataPort4, PositionCorrectionPort, GNSSSignal, ControlPort, DataPort, ControlPort, DataPort, ControlPort, DataPort, ControlPort, DataPort, ControlPort, DataPort, ControlPort, DataPort, ControlPort, DataPort, ControlPort, DataPort, ControlPort, DataPort, ControlPort, DataPort, ControlPort, DataPort, ControlPort, DataPort, ControlPort, DataPort, ControlPort, DataPort, ControlPort, DataPort, ControlPort, DataPort, eth1, eth2, eth3, eth4, eth5, eth6, eth1, eth2, eth3, eth4, eth5, eth6, eth1, eth2, eth3, eth4, eth5, eth6, eth1, eth2, eth3, eth4, eth5, eth6, eth1, eth2, eth3, eth4, eth5, eth6, eth1, eth2, eth3, eth4, eth5, eth6, eth7, eth8, eth1, eth2, eth3, eth4, eth5, eth6, eth7, eth8, RTK_UHF_DataIn, GNSSSignalIn, eth1, eth2, DataOut, PositionCorrectionData, DataPort, Incoming"
APS-Communication_Architecture_APS_NetworkAndSystemManagement_impl_1,26,"NICTeaming, UAM, ConnectivityManager_Process, NI, TPC, TRC, QoSC, NMT, NSU, NSM, NSC, NDBC, DigitalLogbook","eth1, eth2, Veth1, Veth2, Teamedeth, DataPort, DataPort, Dataport"
APS-Communication_Architecture_APS_SafetySystem_impl_1,40,"this_GeneralIOModule1, this_UserPanel1, this_Alarm1, this_Lantern1, this_AnchorDrop1, this_Horn1","MainDataPort, BackupDataPort, Input1, Output1, Output2, Output3, Output4, eth1, eth2, Output, Input, Input, Input, Input"
APS-Communication_Architecture_CloudComponent_APSCommunication_impl_1,2,this_CommunicationHubServer,"StakeholderCommunication, InternetAccess, DataPort"
APS-Communication_Architecture_ECT_APSCommunication_impl_1,27,"ECT_EmergencyModule, ECT_EmergencyButtonReceiver","RadioCommunication, AISCommunication, RCCCommunication, MobileCommunication, eth1, eth2, eth3, eth4, WirelessPort, EmergencySignal"
APS-Communication_Architecture_ECT_EmergencyButtonReceiver_impl_1,10,"this_EmergencyCommunicationModule, this_EmergencyNotification","EmergencySignal, EmergencySignalIn, EmergencySignalOut, EmergencySignalReceived"
APS-Communication_Architecture_Mobile5GNetwork_APSCommunication_impl_1,4,"this_Connection_5G, this_Connection_5G_RCC","APSCommunication, RCCCommunication, CloudCommunication, SSSCommunication, ClientConnection, ServerConnection, ClientConnection, ServerConnection"
APS-Communication_Architecture_Overall_APSCommunicationArchitecture_impl_1,27,"APS, this_InternetModule, this_RCCAPSModule, this_TrafficModule, EmergencyControlModule, this_Switch_Main_CoreCommunication, this_Switch_Backup_CoreCommunication, PrimaryWANLoadBalancer, SecondaryWANLoadBalancer, this_ASC, ASC_Main, COLAVandSSITAW_Main, ASC_Process, ASC_IDS, ASC_Discover, ASC_CDA, ASC_CP, ASC_CAM, ASC_MV, ASC_SS, ASC_VM, ASC_DK, NICTeaming, NetworkAndSystemManagement_Main, NICTeaming, UAM, ConnectivityManager_Process, NI, TPC, TRC, QoSC, NMT, NSU, NSM, NSC, NDBC, DigitalLogbook, IS3MS_Main, NICTeaming, SIEM, ASC_Backup, COLAVandSSITAW_Backup, ASC_Process, ASC_IDS, ASC_Discover, ASC_CDA, ASC_CP, ASC_CAM, ASC_MV, ASC_SS, ASC_VM, ASC_DK, NICTeaming, NetworkAndSystemManagement_Backup, NICTeaming, UAM, ConnectivityManager_Process, NI, TPC, TRC, QoSC, NMT, NSU, NSM, NSC, NDBC, DigitalLogbook, IS3MS_Backup, NICTeaming, SIEM, this_MachinerySystem, this_IOCard1, this_IOCard2, this_AzimuthThruster1, this_AzimuthThruster2, this_AzimuthThruster3, this_AzimuthThruster4, this_NavigationSystem, this_Lidar1, this_Lidar2, this_Radar1, this_Radar2, this_Radar3, this_EO1, this_EO2, this_EO3, this_DomeCamera1, this_IRCamera1, this_SPU1, this_SPU2, this_SPU3, this_Radar5, this_SPU5, this_SPU4, this_EO4, this_Lidar4, this_Lidar3, this_EO5, this_Radar4, this_SenseorSwitch, this_GNSS_IMU_Main, GNSS_Security, GNSS_IDS, this_RTK_UHF, this_GNSSReceiver1, this_SenseorSwitch_Backup, this_GNSSReceiver2, this_GNSS_IMU_Backup, GNSS_Security, GNSS_IDS, this_SafetySystem, this_GeneralIOModule1, this_UserPanel1, this_Alarm1, this_Lantern1, this_AnchorDrop1, this_Horn1, this_BMS, this_EmergencyButtonTransmitter, this_EPB, this_EmergencyCommunicationModule, IDS1, IDS2, RCC, this_DPJoystic1, NetworkAndSystemManagement, NICTeaming, UAM, ConnectivityManager_Process, NI, TPC, TRC, QoSC, NMT, NSU, NSM, NSC, NDBC, DigitalLogbook, IS3MS, NICTeaming, SIEM, IDS, this_InternetModule, this_RCCAPSModule, this_TrafficModule, this_ControlComputer_Main, ASC_Process, ASC_IDS, ASC_Discover, ASC_CDA, ASC_CP, ASC_CAM, ASC_MV, ASC_SS, ASC_VM, ASC_DK, NICTeaming, PrimaryWANLoadBalancer, SecondaryWANLoadBalancer, ECT, ECT_EmergencyModule, ECT_EmergencyButtonReceiver, SSS, this_ShoreSensorModule, TIS, TIS_TrafficModule, Ship, Ship_TrafficModule, Stakeholder, this_APSStakeholder, CloudComponent, this_CommunicationHubServer, Mobile5GNetwork, this_Connection_5G, this_Connection_5G_RCC, AidsToNavigation, RTKBaseStation, GNSSTransmitter","InternetAccess, AISCommunication, RCCCommunication, RadioCommunication, UHFPositionCorrection, GNSSSignal, MobileCommunication, UplinkDownlinkPort, ManagementPort, eth1, eth2, ControlPort, eth1, eth2, WirelessPort, ControlPort, DataPort, NavDataPort, GNSSSignal, ControlPort, eth1, eth2, eth3, eth4, WirelessPort, eth1, eth2, eth3, eth4, eth5, eth6, eth7, eth8, eth9, eth10, eth11, eth12, eth13, eth14, eth15, eth16, eth17, eth18, eth19, eth20, RedundancyPort, eth1, eth2, eth3, eth4, eth5, eth6, eth7, eth8, eth9, eth10, eth11, eth12, eth13, eth14, eth15, eth16, eth17, eth18, eth19, eth20, RedundancyPort, PrimaryWAN, SecondaryWAN, eth1, eth2, eth3, eth4, eth5, eth6, eth7, eth8, RedundancyPort, PrimaryWAN, SecondaryWAN, eth1, eth2, eth3, eth4, eth5, eth6, eth7, eth8, RedundancyPort, COLAVandSSITAW_Main1, COLAVandSSITAW_Main2, COLAVandSSITAW_Backup1, COLAVandSSITAW_Backup2, EC, NSM_Main1, NSM_Main2, NSM_Backup1, NSM_Backup2, IS3MS_Main1, IS3MS_Main2, IS3MS_Backup1, IS3MS_Backup2, COLAVandSSITAW_Main_Primary, COLAVandSSITAW_Main_Secondary, NetworkAndSystemManagement_Main_Primary, NetworkAndSystemManagement_Main_Secondary, IS3MS_Main_Primar, IS3MS_Main_Secondary, eth1, eth2, Dataport, EmergencyDataPort, DataPort, MainDataPort, MainDataPort, BackupDataPort, MainDataPort, BackupDataPort, MainDataPort, MainDataPort, BackupDataPort, MainDataPort, MainDataPort, MainDataPort, Veth1, Veth2, Teamedeth, eth1, eth2, Veth1, Veth2, Teamedeth, DataPort, DataPort, Dataport, et1, et2, Veth1, Veth2, Teamedeth, DataPort, COLAVandSSITAW_Backup_Primary, COLAVandSSITAW_Backup_Secondary, NetworkAndSystemManagement_Backup_Primary, NetworkAndSystemManagement_Backup_Secondary, IS3MS_Backup_Primar, IS3MS_Backup_Secondary, EmergencyControlPort, eth1, eth2, EmergencyPort, Dataport, EmergencyDataPort, DataPort, MainDataPort, MainDataPort, BackupDataPort, MainDataPort, BackupDataPort, MainDataPort, MainDataPort, BackupDataPort, MainDataPort, MainDataPort, MainDataPort, Veth1, Veth2, Teamedeth, eth1, eth2, Veth1, Veth2, Teamedeth, DataPort, DataPort, Dataport, et1, et2, Veth1, Veth2, Teamedeth, DataPort, MainDataPort1, MainDataPort2, BackupDataPort1, BackupDataPort2, SignalPort1, SignalPort2, eth1, eth2, SignalPort1, SignalPort2, eth1, eth2, SignalPort, SignalPort, SignalPort, SignalPort, MainDataPort1, MainDataPort2, MainDataPort3, MainDataPort4, BackupDataPort1, BackupDataPort2, BackupDataPort3, BackupDataPort4, PositionCorrectionPort, GNSSSignal, ControlPort, DataPort, ControlPort, DataPort, ControlPort, DataPort, ControlPort, DataPort, ControlPort, DataPort, ControlPort, DataPort, ControlPort, DataPort, ControlPort, DataPort, ControlPort, DataPort, ControlPort, DataPort, eth1, eth2, eth3, eth4, eth5, eth6, eth1, eth2, eth3, eth4, eth5, eth6, eth1, eth2, eth3, eth4, eth5, eth6, ControlPort, DataPort, eth1, eth2, eth3, eth4, eth5, eth6, eth1, eth2, eth3, eth4, eth5, eth6, ControlPort, DataPort, ControlPort, DataPort, ControlPort, DataPort, ControlPort, DataPort, ControlPort, DataPort, eth1, eth2, eth3, eth4, eth5, eth6, eth7, eth8, RTK_UHF_DataIn, GNSSSignalIn, eth1, eth2, DataPort, DataPort, DataOut, PositionCorrectionData, DataPort, Incoming, eth1, eth2, eth3, eth4, eth5, eth6, eth7, eth8, DataPort, Incoming, RTK_UHF_DataIn, GNSSSignalIn, eth1, eth2, DataPort, DataPort, MainDataPort, BackupDataPort, Input1, Output1, Output2, Output3, Output4, eth1, eth2, Output, Input, Input, Input, Input, MainDataPort, BackupDataPort, EmergencySignal, ButtonPressed, EmergencySignalIn, EmergencySignalOut, eth1, eth2, eth1, eth2, InternetAccess, APSCommunication, AISCommunication, SignalPort, eth1, eth2, Veth1, Veth2, Teamedeth, DataPort, DataPort, Dataport, et1, et2, Veth1, Veth2, Teamedeth, DataPort, eth1, eth2, UplinkDownlinkPort, ManagementPort, eth1, eth2, eth3, eth4, ControlPort, eth1, eth2, WirelessPort, ControlPort, DataPort, NavDataPort, eth1, eth2, eth3, eth4, SignalPort, Dataport, EmergencyDataPort, DataPort, MainDataPort, MainDataPort, BackupDataPort, MainDataPort, BackupDataPort, MainDataPort, MainDataPort, BackupDataPort, MainDataPort, MainDataPort, MainDataPort, Veth1, Veth2, Teamedeth, PrimaryWAN, SecondaryWAN, eth1, eth2, eth3, eth4, eth5, eth6, eth7, eth8, RedundancyPort, PrimaryWAN, SecondaryWAN, eth1, eth2, eth3, eth4, eth5, eth6, eth7, eth8, RedundancyPort, RadioCommunication, AISCommunication, RCCCommunication, MobileCommunication, eth1, eth2, eth3, eth4, WirelessPort, EmergencySignal, APSCommunication, RCCCommunication, InternetAccess, ControlPort, DataPort, AISCommunication, DataPort, AISCommunication, DataPort, InternetAccess, DataPort, StakeholderCommunication, InternetAccess, DataPort, APSCommunication, RCCCommunication, CloudCommunication, SSSCommunication, ClientConnection, ServerConnection, ClientConnection, ServerConnection, UHFPositionCorrection, GNSSSignal, CorrectionData, GNSSData"
