Model,Component,Feature,ConnectionInstance
adiru_aadl_subsystem_ir_system_impl_1,"ir_memory, ir_process, IR_thread, cpu, partition_IR","afdx_access, altitude_in, true_airspeed_in, inertial_altitude_out, inertial_vs_out, present_pos_lat_out, present_pos_long_out, ground_speed_out, track_angle_true_D, magnetic_heading, wind_speed_D, wind_direction_true_D, true_heading_D, body_pitch_acc_out, body_roll_acc_out, body_yaw_acc_out, set_latitude_in, set_longitude_in, set_magnetic_heading_in, m1_disc, m2_disc, altitude_in, true_airspeed_in, inertial_altitude_out, inertial_vs_out, present_pos_lat_out, present_pos_long_out, ground_speed_out, track_angle_true_D, magnetic_heading, wind_speed_D, wind_direction_true_D, true_heading_D, body_pitch_acc_out, body_roll_acc_out, body_yaw_acc_out, set_latitude, set_longitude, set_magnetic_heading, th_altitude, th_true_airspeed, th_inertial_altitude, th_inertial_vs, th_present_pos_lat, th_present_pos_long, th_ground_speed, th_track_angle_true_D, th_magnetic_heading, th_wind_speed_D, th_wind_direction_true_D, th_true_heading_D, th_body_pitch_acc, th_body_roll_acc, th_body_yaw_acc, th_set_latitude, th_set_longitude, th_set_magnetic_heading","altitude_in -> ir_process.IR_thread.th_altitude, true_airspeed_in -> ir_process.IR_thread.th_true_airspeed, set_latitude_in -> ir_process.IR_thread.th_set_latitude, set_longitude_in -> ir_process.IR_thread.th_set_longitude, set_magnetic_heading_in -> ir_process.IR_thread.th_set_magnetic_heading, ir_process.IR_thread.th_inertial_altitude -> inertial_altitude_out, ir_process.IR_thread.th_inertial_vs -> inertial_vs_out, ir_process.IR_thread.th_present_pos_lat -> present_pos_lat_out, ir_process.IR_thread.th_present_pos_long -> present_pos_long_out, ir_process.IR_thread.th_ground_speed -> ground_speed_out, ir_process.IR_thread.th_track_angle_true_D -> track_angle_true_D, ir_process.IR_thread.th_magnetic_heading -> magnetic_heading, ir_process.IR_thread.th_wind_speed_D -> wind_speed_D, ir_process.IR_thread.th_wind_direction_true_D -> wind_direction_true_D, ir_process.IR_thread.th_true_heading_D -> true_heading_D, ir_process.IR_thread.th_body_pitch_acc -> body_pitch_acc_out, ir_process.IR_thread.th_body_roll_acc -> body_roll_acc_out, ir_process.IR_thread.th_body_yaw_acc -> body_yaw_acc_out"
Aircraft_aircraft_functional_aircraft_functional_model_1,"sys_stability_pitch, sys_spoilers, sys_thrust_management, sys_forward_thrust","isFailing, isFailing, isFailing, isFailing, isFailing",
air_Ex1_s_i_1,"p, pt, q, qt","pout, ptout, qin, qtin",p.pt.ptout -> q.qt.qtin
air_Ex2_s_i_1,"p, ptout, ptin, q, qt, r, rt","sin1, sin2, sout, sout2, pin, pout, pout2, unconnectedOut, pout3, ptoutin, ptoutout, ptinin, ptinout, ptinout2, qin, qin2, qout, qout2, qtin, qtout, rin, rin2, rin3, rin4, rout, rout2, rtin, rtout","ptout.ptoutout -> ptin.ptinin, ptin.ptinout -> ptout.ptoutin, sin1 -> q.qt.qtin, sin2 -> q.qin2, p.ptout.ptoutout -> q.qt.qtin, p.ptout.ptoutout -> r.rt.rtin, p.ptin.ptinout -> r.rt.rtin, p.ptin.ptinout2 -> r.rin3, q.qout2 -> r.rin4, q.qt.qtout -> r.rt.rtin, r.rout2 -> sout, r.rt.rtout -> sout"
air_Ex2_wrapper_i_1,"s, p, ptout, ptin, q, qt, r, rt, t","sin1, sin2, sout, sout2, pin, pout, pout2, unconnectedOut, pout3, ptoutin, ptoutout, ptinin, ptinout, ptinout2, qin, qin2, qout, qout2, qtin, qtout, rin, rin2, rin3, rin4, rout, rout2, rtin, rtout, tin","ptout.ptoutout -> ptin.ptinin, ptin.ptinout -> ptout.ptoutin, p.ptout.ptoutout -> q.qt.qtin, p.ptout.ptoutout -> r.rt.rtin, p.ptin.ptinout -> r.rt.rtin, p.ptin.ptinout2 -> r.rin3, q.qout2 -> r.rin4, q.qt.qtout -> r.rt.rtin, s.sout2 -> t.tin"
air_Ex3_as_i_1,"ap, at","asout, apout, atout",ap.at.atout -> asout
air_Ex3_bs_i_1,"bp, bt","bsin, bpin, btin",bsin -> bp.bt.btin
air_Ex3_wrapper_i_1,"as, ap, at, bs, bp, bt","asout, apout, atout, bsin, bpin, btin",as.ap.at.atout -> bs.bp.bt.btin
alisa-response-time_Simple_system_Computation_chain_Impl_1,"first_process, second_process","datain, dataout, datain, dataout, datain, dataout","datain -> first_process.datain, first_process.dataout -> second_process.datain, second_process.dataout -> dataout"
An-AADL-Model-of-Smart-Home-System_Clients_Clients_impl_1,CLIENT_CONTROL_UNIT,"in_clients_mcr, out_clients_mcr, in_clients_rs, out_clients_rs, ccu_data_receiver, ccu_data_sender","in_clients_mcr -> CLIENT_CONTROL_UNIT.ccu_data_receiver, in_clients_rs -> CLIENT_CONTROL_UNIT.ccu_data_receiver, CLIENT_CONTROL_UNIT.ccu_data_sender -> out_clients_mcr, CLIENT_CONTROL_UNIT.ccu_data_sender -> out_clients_rs"
An-AADL-Model-of-Smart-Home-System_MainControlRouter_MainControlRouter_impl_1,"ZIGBEE_DEVICE_CONTROLLER, IP_DEVICE_CONTROLLER, REMOTE_MSG_CONTROL, MAIN_CONTROLLER","temperature_in, smoke_status_out, in_mcr_remote, out_mcr_remote, in_mcr_zd, out_mcr_zd, in_mcr_ipd, out_mcr_ipd, dev_data_receiver, dev_data_sender, ctr_data_receiver, ctr_data_sender, dev_data_receiver, dev_data_sender, ctr_data_receiver, ctr_data_sender, app_data_receiver, app_data_sender, ctr_data_receiver, ctr_data_sender, zdc_data_receiver, zdc_data_sender, ipdc_data_receiver, ipdc_data_sender, remote_data_receiver, remote_data_sender","in_mcr_remote -> REMOTE_MSG_CONTROL.app_data_receiver, in_mcr_zd -> ZIGBEE_DEVICE_CONTROLLER.dev_data_receiver, in_mcr_ipd -> IP_DEVICE_CONTROLLER.dev_data_receiver, ZIGBEE_DEVICE_CONTROLLER.dev_data_sender -> out_mcr_zd, ZIGBEE_DEVICE_CONTROLLER.ctr_data_sender -> MAIN_CONTROLLER.zdc_data_receiver, IP_DEVICE_CONTROLLER.dev_data_sender -> out_mcr_ipd, IP_DEVICE_CONTROLLER.ctr_data_sender -> MAIN_CONTROLLER.ipdc_data_receiver, REMOTE_MSG_CONTROL.app_data_sender -> out_mcr_remote, REMOTE_MSG_CONTROL.ctr_data_sender -> MAIN_CONTROLLER.remote_data_receiver, MAIN_CONTROLLER.zdc_data_sender -> ZIGBEE_DEVICE_CONTROLLER.ctr_data_receiver, MAIN_CONTROLLER.ipdc_data_sender -> IP_DEVICE_CONTROLLER.ctr_data_receiver, MAIN_CONTROLLER.remote_data_sender -> REMOTE_MSG_CONTROL.ctr_data_receiver"
An-AADL-Model-of-Smart-Home-System_RemoteServer_RemoteServer_impl_1,"CLIENT_CONTROLLER, ROUTER_CONTROLLER","in_rs_mcr, out_rs_mcr, in_rs_clients, out_rs_clients, cc_data_receiver, cc_data_sender, rc_data_receiver, rc_data_sender","in_rs_mcr -> ROUTER_CONTROLLER.rc_data_receiver, in_rs_clients -> CLIENT_CONTROLLER.cc_data_receiver, CLIENT_CONTROLLER.cc_data_sender -> out_rs_clients, ROUTER_CONTROLLER.rc_data_sender -> out_rs_mcr"
An-AADL-Model-of-Smart-Home-System_smart_home_system_smart_home_impl_1,"ZIGBEE_DEVICES, IP_DEVICES, MAIN_CONTROL_ROUTER, ZIGBEE_DEVICE_CONTROLLER, IP_DEVICE_CONTROLLER, REMOTE_MSG_CONTROL, MAIN_CONTROLLER, REMOTE_SERVER, CLIENT_CONTROLLER, ROUTER_CONTROLLER, CLIENTS, CLIENT_CONTROL_UNIT","Sensing, out_zd_mcr, in_ipd_mcr, out_ipd_mcr, temperature_in, smoke_status_out, in_mcr_remote, out_mcr_remote, in_mcr_zd, out_mcr_zd, in_mcr_ipd, out_mcr_ipd, dev_data_receiver, dev_data_sender, ctr_data_receiver, ctr_data_sender, dev_data_receiver, dev_data_sender, ctr_data_receiver, ctr_data_sender, app_data_receiver, app_data_sender, ctr_data_receiver, ctr_data_sender, zdc_data_receiver, zdc_data_sender, ipdc_data_receiver, ipdc_data_sender, remote_data_receiver, remote_data_sender, in_rs_mcr, out_rs_mcr, in_rs_clients, out_rs_clients, cc_data_receiver, cc_data_sender, rc_data_receiver, rc_data_sender, in_clients_mcr, out_clients_mcr, in_clients_rs, out_clients_rs, ccu_data_receiver, ccu_data_sender","ZIGBEE_DEVICE_CONTROLLER.ctr_data_sender -> MAIN_CONTROLLER.zdc_data_receiver, IP_DEVICE_CONTROLLER.ctr_data_sender -> MAIN_CONTROLLER.ipdc_data_receiver, REMOTE_MSG_CONTROL.ctr_data_sender -> MAIN_CONTROLLER.remote_data_receiver, MAIN_CONTROLLER.zdc_data_sender -> ZIGBEE_DEVICE_CONTROLLER.ctr_data_receiver, MAIN_CONTROLLER.ipdc_data_sender -> IP_DEVICE_CONTROLLER.ctr_data_receiver, MAIN_CONTROLLER.remote_data_sender -> REMOTE_MSG_CONTROL.ctr_data_receiver, ZIGBEE_DEVICES.out_zd_mcr -> MAIN_CONTROL_ROUTER.ZIGBEE_DEVICE_CONTROLLER.dev_data_receiver, IP_DEVICES.out_ipd_mcr -> MAIN_CONTROL_ROUTER.IP_DEVICE_CONTROLLER.dev_data_receiver, MAIN_CONTROL_ROUTER.ZIGBEE_DEVICE_CONTROLLER.dev_data_sender -> ZIGBEE_DEVICES.Sensing, MAIN_CONTROL_ROUTER.IP_DEVICE_CONTROLLER.dev_data_sender -> IP_DEVICES.in_ipd_mcr, MAIN_CONTROL_ROUTER.REMOTE_MSG_CONTROL.app_data_sender -> REMOTE_SERVER.ROUTER_CONTROLLER.rc_data_receiver, MAIN_CONTROL_ROUTER.REMOTE_MSG_CONTROL.app_data_sender -> CLIENTS.CLIENT_CONTROL_UNIT.ccu_data_receiver, REMOTE_SERVER.CLIENT_CONTROLLER.cc_data_sender -> CLIENTS.CLIENT_CONTROL_UNIT.ccu_data_receiver, REMOTE_SERVER.ROUTER_CONTROLLER.rc_data_sender -> MAIN_CONTROL_ROUTER.REMOTE_MSG_CONTROL.app_data_receiver, CLIENTS.CLIENT_CONTROL_UNIT.ccu_data_sender -> MAIN_CONTROL_ROUTER.REMOTE_MSG_CONTROL.app_data_receiver, CLIENTS.CLIENT_CONTROL_UNIT.ccu_data_sender -> REMOTE_SERVER.CLIENT_CONTROLLER.cc_data_receiver"
APS-Communication_Architecture_AidsToNavigation_AidsToNavigation_impl_1,"RTKBaseStation, GNSSTransmitter","UHFPositionCorrection, GNSSSignal, CorrectionData, GNSSData",RTKBaseStation.CorrectionData -> UHFPositionCorrection
