Model,Cluster,Component,Feature
AADLib_mars_pathfinder_sys_mars_pathfinder_impl_1,40,"VME, bus_1553, radio, coupler, camera, altimeter, accelerometer, meterological, sun_sensors, star_analyser, thrusters, valves, memories, prs_PSC, data_rw, bus_scheduling, data_distribution, control_task, radio_task, camera_task, mesure_task, meteo_task, rs_6000","emission_data, reception_data, req_access_vme, camera_control, emission_data, control_data, reception_data, images_data, measured_data, req_access_1553, camera_control, images_data, req_access_vme, measured_data, req_access_1553, X, Y, Z, measured_data, req_access_1553, measured_data, req_access_1553, measured_data, req_access_1553, measured_data, req_access_1553, control_data, req_access_1553, control_data, req_access_1553, req_access_vme, camera_control, emission_data, control_data, reception_data, images_data, measured_data, control_data, measured_data, req_data_rw, req_data_rw, reception_data, emission_data, images_data, camera_control, req_data_rw, req_data_rw, req_access_vme"
AADLib_MinePump_BA_MinePump_impl_1,44,"Software, WaterLevelMonitoring_Thread, MethaneMonitoring_Thread, PumpCtrl_Thread, WaterAlarm_Thread, Hardware","WaterAlarm, MethaneLevel, WaterAlarm, MethaneLevel, WaterLevel, WaterAlarm"
AADLib_MinePump_MinePump_impl_1,44,"Software, WaterLevelMonitoring_Thread, MethaneMonitoring_Thread, PumpCtrl_Thread, WaterAlarm_Thread, Hardware","WaterAlarm, MethaneLevel, WaterAlarm, MethaneLevel, WaterLevel, WaterAlarm"
AADLib_minirocket_system_minirocket_impl_1,39,"I2C_bus, USB1_bus, UART1_bus, UART2_bus, TWI_ARM9, UART1_ARM9, UART2_ARM9, USB1_ARM9, PRESSURE, INERTIAL, GPS, CAMERA, proc_2, TM_manager, TC_manager, PRESSURE_manager, CL_manager, SE_manager, D_manager, GPS_manager, INERTIAL_manager, CAMERA_manager, CPU_ARM9","Serial_Wire, Serial_Wire, Serial_Wire, Serial_Wire, proc_evt, Serial_Wire, proc_evt, Serial_Wire, proc_evt, Serial_Wire, proc_evt, Serial_Wire, Supply, TC_frame, TM_frame, PRESSURE_meas, TM_frame, TC_frame, PRESSURE_meas, State_estimation, TC_frame, State_estimation, TM_frame, GPS_meas, INERTIAL_meas, Decision, Decision, CAMERA_meas, GPS_meas, INERTIAL_meas, CAMERA_meas, Supply"
AADLib_Mixin_Demo_impl_1,38,"Mix_1, Mix_2","Port_1, Port_2, Port_1, Port_2"
AADLib_MoDeVVa_modevva_impl_1,36,"Proc, mbx, regulate, display, acquire, CPU","mbx, mbx"
AADLib_Pacemaker_Pkg_DeviceControllerMonitor_others_1,9,"Lead, PacemakerSW, VRPTimeout, LRLTimeout, VVIMode, vrp, HWPlatform","VentricleSense, VentriclePulse, Normal_Beat, s, p, n, input, output, input, output, s, lrl_timeout, vrp_timeout, p, n, p_or_n1, p_or_n2"
AADLib_paparazzi_system_airborne_impl_1,39,"SPI_Bus, fly_by_wire, Mem_Bus, Dev_Bus, Recpt_dv, Cpt_dv, Ser_Rudder_dv, Ser_Elevator_dv, Ser_AileronL_dv, Ser_AileronR_dv, Ser_MotorL_dv, Ser_MotorR_dv, Ram, Proc_RcptCde_PilotServ, System_Mode, Radio_Ok, Radio_Really_Lost, Mega128_Ok, Rec_Dec_Th, Send_Th, Pilot_Serv_Th, Check_Ap_Th, Check_Fail_Th, Interrupt_Elevator_Th, Interrupt_MotorL_Th, Interrupt_MotorR_Th, Interrupt_AileronL_Th, Interrupt_AileronR_Th, Interrupt_Rudder_Th, Interrupt_SPI_1, Interrupt_RC_Th, MCU1_P, autopilot, Mem_Bus, Dev_Bus, Modem_Bus, P_dv, T_dv, Compas_dv, V_Air_dv, Cam_dv, Emet_dv, GPS_dv, IR_dv, Ram, N_S_C_proc, AP_Data, channels, data_0, data_1, data_2, data_3, data_4, data_5, data_6, data_7, data_8, ppm_cpt, satus, nb_err, vsupply, Data_Acq_Filt_Th, Alt_Ctrl_Th, Nav_Th, Climb_Ctrl_Th, Stab_Th, Send_MCU1_Th, Send_Grd_Station_Th, Interrupt_SPI_Th1, Interrupt_SPI_Th2, Interrupt_Modem_Th, Interrupt_GPS_Th, Ctrl_By_RC_Th, Proc_0","RC_EvtData_Input, SPI_Con, RC_EvtData_Input, AP_EvtData_Input, D_MCU1_Output, RC_Input, RC_Output, RC_Evt_Output, Dev_Bus, Data_Elev_Input, Data_AilL_Input, Data_AilR_Input, Data_MotorL_Input, Data_MotorR_Input, Data_Rudder_Input, Data_Elev_Output, Data_AilL_Output, Data_AilR_Output, Data_MotorL_Output, Data_MotorR_Output, Data_Rudder_Output, Dev_Bus, Data_Input, Dev_bus, Data_Input, Dev_bus, Data_Input, Dev_bus, Data_Input, Dev_bus, Data_Input, Dev_bus, Data_Input, Dev_bus, Mem_Bus, Cde_Elevator_Output, Cde_MotorL_Output, Cde_MotorR_Output, Cde_AileronL_Output, Cde_AileronR_Output, Cde_Rudder_Output, Radio_Cdes_Input, AP_Cdes_Input, Cdes_Vol_Output, RC_Evt_Input, MCU1_Data_Input, Radio_Ok_Input, Radio_Really_Lost_Input, MCU1_Send_Output, Data_Output, Signal_Input, Data_Output, Signal_Input, Data_Output, Signal_Input, Data_Output, Signal_Input, Data_Output, Signal_Input, Data_Output, Signal_Input, Data_Rec_MCU1_Output, Evt_Rec_SPI_Input, Data_Send_SPI_Output, Evt_Send_SPI_Input, AP_Evt_Output, RC_Evt_Input, Mem_Bus, Dev_Bus, SPI, SPI_Con, D_MCU1_Input, D_MCU0_Output, P_Output, Dev_Bus, T_Output, Dev_Bus, Compas_Output, Dev_Bus, V_Air_Output, Dev_Bus, Video_Output, Dev_Bus, Video_Input, Trans_Data_Output, Video_Output, Trans_Data_Input, Modem_Bus, Dev_Bus, GPS_Output, Error_Output, Dev_Bus, IR_Output, Error_Output, Dev_Bus, Mem_Bus, IR_Input, P_Input, T_Input, Compas_Input, V_Air_Input, MCU1_Data_Input, GPS_Input, Trans_MCU0_Output, Trans_Sol_Output, GPS_Evt_Input, GPS_Output, Altitude_Desiree_Input, Montee_Desiree_Output, GPS_Data_Input, Altitude_Desiree_Output, Montee_Desiree_Input, IR_Input, MCU0_Send_Output, Data_Output, Evt_Rec_SPI_Input, Data_Rec_MCU0_Output, Data_Send_SPI_Output, Evt_Send_SPI_Input, Data_Rec_MCU0_Output, Data_Send_SPI_Output, Data_Send_SPI_Input, Data_Rec_MCU0_Input, Data_Input, Data_Output, GPS_Input, Mem_Bus, Dev_Bus, SPI"
AADLib_paparazzi_system_paparazzi_basic_archi_1,39,"airborne, SPI_Bus, fly_by_wire, Mem_Bus, Dev_Bus, Recpt_dv, Cpt_dv, Ser_Rudder_dv, Ser_Elevator_dv, Ser_AileronL_dv, Ser_AileronR_dv, Ser_MotorL_dv, Ser_MotorR_dv, Ram, Proc_RcptCde_PilotServ, System_Mode, Radio_Ok, Radio_Really_Lost, Mega128_Ok, Rec_Dec_Th, Send_Th, Pilot_Serv_Th, Check_Ap_Th, Check_Fail_Th, Interrupt_Elevator_Th, Interrupt_MotorL_Th, Interrupt_MotorR_Th, Interrupt_AileronL_Th, Interrupt_AileronR_Th, Interrupt_Rudder_Th, Interrupt_SPI_1, Interrupt_RC_Th, MCU1_P, autopilot, Mem_Bus, Dev_Bus, Modem_Bus, P_dv, T_dv, Compas_dv, V_Air_dv, Cam_dv, Emet_dv, GPS_dv, IR_dv, Ram, N_S_C_proc, AP_Data, channels, data_0, data_1, data_2, data_3, data_4, data_5, data_6, data_7, data_8, ppm_cpt, satus, nb_err, vsupply, Data_Acq_Filt_Th, Alt_Ctrl_Th, Nav_Th, Climb_Ctrl_Th, Stab_Th, Send_MCU1_Th, Send_Grd_Station_Th, Interrupt_SPI_Th1, Interrupt_SPI_Th2, Interrupt_Modem_Th, Interrupt_GPS_Th, Ctrl_By_RC_Th, Proc_0","RC_EvtData_Input, SPI_Con, RC_EvtData_Input, AP_EvtData_Input, D_MCU1_Output, RC_Input, RC_Output, RC_Evt_Output, Dev_Bus, Data_Elev_Input, Data_AilL_Input, Data_AilR_Input, Data_MotorL_Input, Data_MotorR_Input, Data_Rudder_Input, Data_Elev_Output, Data_AilL_Output, Data_AilR_Output, Data_MotorL_Output, Data_MotorR_Output, Data_Rudder_Output, Dev_Bus, Data_Input, Dev_bus, Data_Input, Dev_bus, Data_Input, Dev_bus, Data_Input, Dev_bus, Data_Input, Dev_bus, Data_Input, Dev_bus, Mem_Bus, Cde_Elevator_Output, Cde_MotorL_Output, Cde_MotorR_Output, Cde_AileronL_Output, Cde_AileronR_Output, Cde_Rudder_Output, Radio_Cdes_Input, AP_Cdes_Input, Cdes_Vol_Output, RC_Evt_Input, MCU1_Data_Input, Radio_Ok_Input, Radio_Really_Lost_Input, MCU1_Send_Output, Data_Output, Signal_Input, Data_Output, Signal_Input, Data_Output, Signal_Input, Data_Output, Signal_Input, Data_Output, Signal_Input, Data_Output, Signal_Input, Data_Rec_MCU1_Output, Evt_Rec_SPI_Input, Data_Send_SPI_Output, Evt_Send_SPI_Input, AP_Evt_Output, RC_Evt_Input, Mem_Bus, Dev_Bus, SPI, SPI_Con, D_MCU1_Input, D_MCU0_Output, P_Output, Dev_Bus, T_Output, Dev_Bus, Compas_Output, Dev_Bus, V_Air_Output, Dev_Bus, Video_Output, Dev_Bus, Video_Input, Trans_Data_Output, Video_Output, Trans_Data_Input, Modem_Bus, Dev_Bus, GPS_Output, Error_Output, Dev_Bus, IR_Output, Error_Output, Dev_Bus, Mem_Bus, IR_Input, P_Input, T_Input, Compas_Input, V_Air_Input, MCU1_Data_Input, GPS_Input, Trans_MCU0_Output, Trans_Sol_Output, GPS_Evt_Input, GPS_Output, Altitude_Desiree_Input, Montee_Desiree_Output, GPS_Data_Input, Altitude_Desiree_Output, Montee_Desiree_Input, IR_Input, MCU0_Send_Output, Data_Output, Evt_Rec_SPI_Input, Data_Rec_MCU0_Output, Data_Send_SPI_Output, Evt_Send_SPI_Input, Data_Rec_MCU0_Output, Data_Send_SPI_Output, Data_Send_SPI_Input, Data_Rec_MCU0_Input, Data_Input, Data_Output, GPS_Input, Mem_Bus, Dev_Bus, SPI"
AADLib_paparazzi_system_paparazzi_PnP_tasks_interruptions_1,39,"airborne, SPI_Bus, fly_by_wire, Mem_Bus, Dev_Bus, Recpt_dv, Cpt_dv, Ser_Rudder_dv, Ser_Elevator_dv, Ser_AileronL_dv, Ser_AileronR_dv, Ser_MotorL_dv, Ser_MotorR_dv, Ram, Proc_RcptCde_PilotServ, System_Mode, Radio_Ok, Radio_Really_Lost, Mega128_Ok, Rec_Dec_Th, Send_Th, Pilot_Serv_Th, Check_Ap_Th, Check_Fail_Th, Interrupt_Elevator_Th, Interrupt_MotorL_Th, Interrupt_MotorR_Th, Interrupt_AileronL_Th, Interrupt_AileronR_Th, Interrupt_Rudder_Th, Interrupt_SPI_1, Interrupt_RC_Th, MCU1_P, autopilot, Mem_Bus, Dev_Bus, Modem_Bus, P_dv, T_dv, Compas_dv, V_Air_dv, Cam_dv, Emet_dv, GPS_dv, IR_dv, Ram, N_S_C_proc, AP_Data, channels, data_0, data_1, data_2, data_3, data_4, data_5, data_6, data_7, data_8, ppm_cpt, satus, nb_err, vsupply, Data_Acq_Filt_Th, Alt_Ctrl_Th, Nav_Th, Climb_Ctrl_Th, Stab_Th, Send_MCU1_Th, Send_Grd_Station_Th, Interrupt_SPI_Th1, Interrupt_SPI_Th2, Interrupt_Modem_Th, Interrupt_GPS_Th, Ctrl_By_RC_Th, Proc_0","RC_EvtData_Input, SPI_Con, RC_EvtData_Input, AP_EvtData_Input, D_MCU1_Output, RC_Input, RC_Output, RC_Evt_Output, Dev_Bus, Data_Elev_Input, Data_AilL_Input, Data_AilR_Input, Data_MotorL_Input, Data_MotorR_Input, Data_Rudder_Input, Data_Elev_Output, Data_AilL_Output, Data_AilR_Output, Data_MotorL_Output, Data_MotorR_Output, Data_Rudder_Output, Dev_Bus, Data_Input, Dev_bus, Data_Input, Dev_bus, Data_Input, Dev_bus, Data_Input, Dev_bus, Data_Input, Dev_bus, Data_Input, Dev_bus, Mem_Bus, Cde_Elevator_Output, Cde_MotorL_Output, Cde_MotorR_Output, Cde_AileronL_Output, Cde_AileronR_Output, Cde_Rudder_Output, Radio_Cdes_Input, AP_Cdes_Input, Cdes_Vol_Output, RC_Evt_Input, MCU1_Data_Input, Radio_Ok_Input, Radio_Really_Lost_Input, MCU1_Send_Output, Data_Output, Signal_Input, Data_Output, Signal_Input, Data_Output, Signal_Input, Data_Output, Signal_Input, Data_Output, Signal_Input, Data_Output, Signal_Input, Data_Rec_MCU1_Output, Evt_Rec_SPI_Input, Data_Send_SPI_Output, Evt_Send_SPI_Input, AP_Evt_Output, RC_Evt_Input, Mem_Bus, Dev_Bus, SPI, SPI_Con, D_MCU1_Input, D_MCU0_Output, P_Output, Dev_Bus, T_Output, Dev_Bus, Compas_Output, Dev_Bus, V_Air_Output, Dev_Bus, Video_Output, Dev_Bus, Video_Input, Trans_Data_Output, Video_Output, Trans_Data_Input, Modem_Bus, Dev_Bus, GPS_Output, Error_Output, Dev_Bus, IR_Output, Error_Output, Dev_Bus, Mem_Bus, IR_Input, P_Input, T_Input, Compas_Input, V_Air_Input, MCU1_Data_Input, GPS_Input, Trans_MCU0_Output, Trans_Sol_Output, GPS_Evt_Input, GPS_Output, Altitude_Desiree_Input, Montee_Desiree_Output, GPS_Data_Input, Altitude_Desiree_Output, Montee_Desiree_Input, IR_Input, MCU0_Send_Output, Data_Output, Evt_Rec_SPI_Input, Data_Rec_MCU0_Output, Data_Send_SPI_Output, Evt_Send_SPI_Input, Data_Rec_MCU0_Output, Data_Send_SPI_Output, Data_Send_SPI_Input, Data_Rec_MCU0_Input, Data_Input, Data_Output, GPS_Input, Mem_Bus, Dev_Bus, SPI"
AADLib_paparazzi_system_paparazzi_PP_tasks_AP_interruptions_1,39,"airborne, SPI_Bus, fly_by_wire, Mem_Bus, Dev_Bus, Recpt_dv, Cpt_dv, Ser_Rudder_dv, Ser_Elevator_dv, Ser_AileronL_dv, Ser_AileronR_dv, Ser_MotorL_dv, Ser_MotorR_dv, Ram, Proc_RcptCde_PilotServ, System_Mode, Radio_Ok, Radio_Really_Lost, Mega128_Ok, Rec_Dec_Th, Send_Th, Pilot_Serv_Th, Check_Ap_Th, Check_Fail_Th, Interrupt_Elevator_Th, Interrupt_MotorL_Th, Interrupt_MotorR_Th, Interrupt_AileronL_Th, Interrupt_AileronR_Th, Interrupt_Rudder_Th, Interrupt_SPI_1, Interrupt_RC_Th, MCU1_P, autopilot, Mem_Bus, Dev_Bus, Modem_Bus, P_dv, T_dv, Compas_dv, V_Air_dv, Cam_dv, Emet_dv, GPS_dv, IR_dv, Ram, N_S_C_proc, AP_Data, channels, data_0, data_1, data_2, data_3, data_4, data_5, data_6, data_7, data_8, ppm_cpt, satus, nb_err, vsupply, Data_Acq_Filt_Th, Alt_Ctrl_Th, Nav_Th, Climb_Ctrl_Th, Stab_Th, Send_MCU1_Th, Send_Grd_Station_Th, Interrupt_SPI_Th1, Interrupt_SPI_Th2, Interrupt_Modem_Th, Interrupt_GPS_Th, Ctrl_By_RC_Th, Proc_0","RC_EvtData_Input, SPI_Con, RC_EvtData_Input, AP_EvtData_Input, D_MCU1_Output, RC_Input, RC_Output, RC_Evt_Output, Dev_Bus, Data_Elev_Input, Data_AilL_Input, Data_AilR_Input, Data_MotorL_Input, Data_MotorR_Input, Data_Rudder_Input, Data_Elev_Output, Data_AilL_Output, Data_AilR_Output, Data_MotorL_Output, Data_MotorR_Output, Data_Rudder_Output, Dev_Bus, Data_Input, Dev_bus, Data_Input, Dev_bus, Data_Input, Dev_bus, Data_Input, Dev_bus, Data_Input, Dev_bus, Data_Input, Dev_bus, Mem_Bus, Cde_Elevator_Output, Cde_MotorL_Output, Cde_MotorR_Output, Cde_AileronL_Output, Cde_AileronR_Output, Cde_Rudder_Output, Radio_Cdes_Input, AP_Cdes_Input, Cdes_Vol_Output, RC_Evt_Input, MCU1_Data_Input, Radio_Ok_Input, Radio_Really_Lost_Input, MCU1_Send_Output, Data_Output, Signal_Input, Data_Output, Signal_Input, Data_Output, Signal_Input, Data_Output, Signal_Input, Data_Output, Signal_Input, Data_Output, Signal_Input, Data_Rec_MCU1_Output, Evt_Rec_SPI_Input, Data_Send_SPI_Output, Evt_Send_SPI_Input, AP_Evt_Output, RC_Evt_Input, Mem_Bus, Dev_Bus, SPI, SPI_Con, D_MCU1_Input, D_MCU0_Output, P_Output, Dev_Bus, T_Output, Dev_Bus, Compas_Output, Dev_Bus, V_Air_Output, Dev_Bus, Video_Output, Dev_Bus, Video_Input, Trans_Data_Output, Video_Output, Trans_Data_Input, Modem_Bus, Dev_Bus, GPS_Output, Error_Output, Dev_Bus, IR_Output, Error_Output, Dev_Bus, Mem_Bus, IR_Input, P_Input, T_Input, Compas_Input, V_Air_Input, MCU1_Data_Input, GPS_Input, Trans_MCU0_Output, Trans_Sol_Output, GPS_Evt_Input, GPS_Output, Altitude_Desiree_Input, Montee_Desiree_Output, GPS_Data_Input, Altitude_Desiree_Output, Montee_Desiree_Input, IR_Input, MCU0_Send_Output, Data_Output, Evt_Rec_SPI_Input, Data_Rec_MCU0_Output, Data_Send_SPI_Output, Evt_Send_SPI_Input, Data_Rec_MCU0_Output, Data_Send_SPI_Output, Data_Send_SPI_Input, Data_Rec_MCU0_Input, Data_Input, Data_Output, GPS_Input, Mem_Bus, Dev_Bus, SPI"
AADLib_paparazzi_system_paparazzi_PP_tasks_interruptions_1,39,"airborne, SPI_Bus, fly_by_wire, Mem_Bus, Dev_Bus, Recpt_dv, Cpt_dv, Ser_Rudder_dv, Ser_Elevator_dv, Ser_AileronL_dv, Ser_AileronR_dv, Ser_MotorL_dv, Ser_MotorR_dv, Ram, Proc_RcptCde_PilotServ, System_Mode, Radio_Ok, Radio_Really_Lost, Mega128_Ok, Rec_Dec_Th, Send_Th, Pilot_Serv_Th, Check_Ap_Th, Check_Fail_Th, Interrupt_Elevator_Th, Interrupt_MotorL_Th, Interrupt_MotorR_Th, Interrupt_AileronL_Th, Interrupt_AileronR_Th, Interrupt_Rudder_Th, Interrupt_SPI_1, Interrupt_RC_Th, MCU1_P, autopilot, Mem_Bus, Dev_Bus, Modem_Bus, P_dv, T_dv, Compas_dv, V_Air_dv, Cam_dv, Emet_dv, GPS_dv, IR_dv, Ram, N_S_C_proc, AP_Data, channels, data_0, data_1, data_2, data_3, data_4, data_5, data_6, data_7, data_8, ppm_cpt, satus, nb_err, vsupply, Data_Acq_Filt_Th, Alt_Ctrl_Th, Nav_Th, Climb_Ctrl_Th, Stab_Th, Send_MCU1_Th, Send_Grd_Station_Th, Interrupt_SPI_Th1, Interrupt_SPI_Th2, Interrupt_Modem_Th, Interrupt_GPS_Th, Ctrl_By_RC_Th, Proc_0","RC_EvtData_Input, SPI_Con, RC_EvtData_Input, AP_EvtData_Input, D_MCU1_Output, RC_Input, RC_Output, RC_Evt_Output, Dev_Bus, Data_Elev_Input, Data_AilL_Input, Data_AilR_Input, Data_MotorL_Input, Data_MotorR_Input, Data_Rudder_Input, Data_Elev_Output, Data_AilL_Output, Data_AilR_Output, Data_MotorL_Output, Data_MotorR_Output, Data_Rudder_Output, Dev_Bus, Data_Input, Dev_bus, Data_Input, Dev_bus, Data_Input, Dev_bus, Data_Input, Dev_bus, Data_Input, Dev_bus, Data_Input, Dev_bus, Mem_Bus, Cde_Elevator_Output, Cde_MotorL_Output, Cde_MotorR_Output, Cde_AileronL_Output, Cde_AileronR_Output, Cde_Rudder_Output, Radio_Cdes_Input, AP_Cdes_Input, Cdes_Vol_Output, RC_Evt_Input, MCU1_Data_Input, Radio_Ok_Input, Radio_Really_Lost_Input, MCU1_Send_Output, Data_Output, Signal_Input, Data_Output, Signal_Input, Data_Output, Signal_Input, Data_Output, Signal_Input, Data_Output, Signal_Input, Data_Output, Signal_Input, Data_Rec_MCU1_Output, Evt_Rec_SPI_Input, Data_Send_SPI_Output, Evt_Send_SPI_Input, AP_Evt_Output, RC_Evt_Input, Mem_Bus, Dev_Bus, SPI, SPI_Con, D_MCU1_Input, D_MCU0_Output, P_Output, Dev_Bus, T_Output, Dev_Bus, Compas_Output, Dev_Bus, V_Air_Output, Dev_Bus, Video_Output, Dev_Bus, Video_Input, Trans_Data_Output, Video_Output, Trans_Data_Input, Modem_Bus, Dev_Bus, GPS_Output, Error_Output, Dev_Bus, IR_Output, Error_Output, Dev_Bus, Mem_Bus, IR_Input, P_Input, T_Input, Compas_Input, V_Air_Input, MCU1_Data_Input, GPS_Input, Trans_MCU0_Output, Trans_Sol_Output, GPS_Evt_Input, GPS_Output, Altitude_Desiree_Input, Montee_Desiree_Output, GPS_Data_Input, Altitude_Desiree_Output, Montee_Desiree_Input, IR_Input, MCU0_Send_Output, Data_Output, Evt_Rec_SPI_Input, Data_Rec_MCU0_Output, Data_Send_SPI_Output, Evt_Send_SPI_Input, Data_Rec_MCU0_Output, Data_Send_SPI_Output, Data_Send_SPI_Input, Data_Rec_MCU0_Input, Data_Input, Data_Output, GPS_Input, Mem_Bus, Dev_Bus, SPI"
AADLib_PartitionedSystemExample_arincsystem_impl_1,36,"mem, part1mem, part2mem, partition1_pr, temperature, order, partition2_pr, sem, blackboard, receiver, printer, cpu, part1, part2","samplingout, queueingin, tempout, order, commandin, order, samplingin, queueingout, temp, newavg, tempavg, need_semaphore, ordersensor, newavg, tempavg, need_semaphore"
AADLib_PING_PING_IMA_1,36,"memst, mem, segment1, segment2, Node_A, Pinger, Node_B, Ping_Me, poll_port, cpu, part1, part2","Data_Source, Data_Source, Data_Sink, Data_Sink"
AADLib_quadrirotorv0_system_arm7_i_1,39,"I2C_bus, three_phases_1_bus, three_phases_2_bus, three_phases_3_bus, three_phases_4_bus, TWI_ARM7, UART0_ARM7, US1, US2, PRESSURE, MOTOR_1, MOTOR_2, MOTOR_3, MOTOR_4, VARIATOR_1, VARIATOR_2, VARIATOR_3, VARIATOR_4, proc_1, TM_manager, TC_manager, US_manager, PRESSURE_manager, ACTUATORS_manager, CPU_ARM7","Serial_Wire, Serial_Wire, Serial_Wire, proc_evt, Serial_Wire, Supply, proc_evt, Serial_Wire, Supply, proc_evt, Serial_Wire, three_phases_Wire, three_phases_Wire, three_phases_Wire, three_phases_Wire, Serial_Wire, three_phases_Wire, Serial_Wire, three_phases_Wire, Serial_Wire, three_phases_Wire, Serial_Wire, three_phases_Wire, TM_frame, TC_frame, US1_meas, US2_meas, PRESSURE_meas, TM_frame, TC_frame, ACTUATORS_cmd, US1_meas, US2_meas, PRESSURE_meas, ACTUATORS_cmd, Supply"
AADLib_quadrirotorv0_system_arm9_i_1,39,"USB1_bus, USB2_bus, UART2_bus, UART0_ARM9, UART1_ARM9, UART2_ARM9, USB1_ARM9, USB2_ARM9, INERTIAL_GPS, TELEMETER, CAMERA, proc_2, CL_manager, SE_manager, D_manager, TELEMETER_manager, INERTIAL_GPS_manager, CAMERA_manager, CPU_ARM9","Serial_Wire, Serial_Wire, Serial_Wire, Serial_Wire, Serial_Wire, Serial_Wire, proc_evt, Serial_Wire, Supply, proc_evt, Serial_Wire, Supply, proc_evt, Serial_Wire, Supply, TC_frame, TM_frame, State_estimation, TC_frame, State_estimation, TM_frame, INERTIAL_GPS_meas, TELEMETER_meas, Decision, Decision, CAMERA_meas, TELEMETER_meas, INERTIAL_GPS_meas, CAMERA_meas, Supply"
AADLib_quadrirotorv0_system_quadrirotorv0_impl_1,39,"UART_IPC_bus, arm7_board, I2C_bus, three_phases_1_bus, three_phases_2_bus, three_phases_3_bus, three_phases_4_bus, TWI_ARM7, UART0_ARM7, US1, US2, PRESSURE, MOTOR_1, MOTOR_2, MOTOR_3, MOTOR_4, VARIATOR_1, VARIATOR_2, VARIATOR_3, VARIATOR_4, proc_1, TM_manager, TC_manager, US_manager, PRESSURE_manager, ACTUATORS_manager, CPU_ARM7, arm9_board, USB1_bus, USB2_bus, UART2_bus, UART0_ARM9, UART1_ARM9, UART2_ARM9, USB1_ARM9, USB2_ARM9, INERTIAL_GPS, TELEMETER, CAMERA, proc_2, CL_manager, SE_manager, D_manager, TELEMETER_manager, INERTIAL_GPS_manager, CAMERA_manager, CPU_ARM9","Serial_Wire, Serial_Wire, Serial_Wire, proc_evt, Serial_Wire, Supply, proc_evt, Serial_Wire, Supply, proc_evt, Serial_Wire, three_phases_Wire, three_phases_Wire, three_phases_Wire, three_phases_Wire, Serial_Wire, three_phases_Wire, Serial_Wire, three_phases_Wire, Serial_Wire, three_phases_Wire, Serial_Wire, three_phases_Wire, TM_frame, TC_frame, US1_meas, US2_meas, PRESSURE_meas, TM_frame, TC_frame, ACTUATORS_cmd, US1_meas, US2_meas, PRESSURE_meas, ACTUATORS_cmd, Supply, Serial_Wire, Serial_Wire, Serial_Wire, Serial_Wire, Serial_Wire, Serial_Wire, proc_evt, Serial_Wire, Supply, proc_evt, Serial_Wire, Supply, proc_evt, Serial_Wire, Supply, TC_frame, TM_frame, State_estimation, TC_frame, State_estimation, TM_frame, INERTIAL_GPS_meas, TELEMETER_meas, Decision, Decision, CAMERA_meas, TELEMETER_meas, INERTIAL_GPS_meas, CAMERA_meas, Supply"
AADLib_quadrirotorv1_system_quadrirotorv1_impl_1,39,"I2C_bus, three_phases_1_bus, three_phases_2_bus, three_phases_3_bus, three_phases_4_bus, USB1_bus, USB2_bus, UART1_bus, UART2_bus, TWI_ARM9, UART1_ARM9, UART2_ARM9, USB1_ARM9, USB2_ARM9, US1, US2, PRESSURE, MOTOR_1, MOTOR_2, MOTOR_3, MOTOR_4, VARIATOR_1, VARIATOR_2, VARIATOR_3, VARIATOR_4, INERTIAL, GPS, TELEMETER, CAMERA, proc_2, TM_manager, TC_manager, US_manager, PRESSURE_manager, ACTUATORS_manager, CL_manager, SE_manager, D_manager, TELEMETER_manager, GPS_manager, INERTIAL_manager, CAMERA_manager, CPU_ARM9","Serial_Wire, Serial_Wire, Serial_Wire, Serial_Wire, Serial_Wire, proc_evt, Serial_Wire, Supply, proc_evt, Serial_Wire, Supply, proc_evt, Serial_Wire, three_phases_Wire, three_phases_Wire, three_phases_Wire, three_phases_Wire, Serial_Wire, three_phases_Wire, Serial_Wire, three_phases_Wire, Serial_Wire, three_phases_Wire, Serial_Wire, three_phases_Wire, proc_evt, Serial_Wire, proc_evt, Serial_Wire, proc_evt, Serial_Wire, Supply, proc_evt, Serial_Wire, Supply, TC_frame, TM_frame, US1_meas, US2_meas, PRESSURE_meas, TM_frame, TC_frame, ACTUATORS_cmd, US1_meas, US2_meas, PRESSURE_meas, ACTUATORS_cmd, State_estimation, TC_frame, State_estimation, TM_frame, GPS_meas, INERTIAL_meas, TELEMETER_meas, Decision, Decision, CAMERA_meas, TELEMETER_meas, GPS_meas, INERTIAL_meas, CAMERA_meas, Supply"
AADLib_radar_system_radar_simple_1,40,"VME, aerial, rotor, monitor, RAM, main, receive, analyse, display, transmit, control_angle, cpu","antenna_out, antenna_in, VME, motor_out, VME, screen_in, VME, VME, receive_pulse, get_angle, to_screen, send_pulse, receiver_out, receiver_in, from_receiver, analyser_out, from_controller, from_transmitter, display_in, display_out, transmitter_out, controller_in, controller_out, VME"
