Model,Component,Feature,ConnectionInstance
6UCubeSat_RTA_Controller_RTA_Controller_Impl_1,"DM_sub, UNV_sub, VER_sub","pre_psi1, pre_psi2, pre_psi3, pre_psi4, psi_dot_comm_1, psi_dot_comm_2, psi_dot_comm_3, psi_dot_comm_4, pre_psi1_in, pre_psi2_in, pre_psi3_in, pre_psi4_in, psi_dot_comm_1_verified_in, psi_dot_comm_2_verified_in, psi_dot_comm_3_verified_in, psi_dot_comm_4_verified_in, psi_dot_comm_1_unverified_in, psi_dot_comm_2_unverified_in, psi_dot_comm_3_unverified_in, psi_dot_comm_4_unverified_in, psi_dot_comm_1_dm, psi_dot_comm_2_dm, psi_dot_comm_3_dm, psi_dot_comm_4_dm, pre_psi1, pre_psi2, pre_psi3, pre_psi4, psi_dot_comm_1, psi_dot_comm_2, psi_dot_comm_3, psi_dot_comm_4, pre_psi1, pre_psi2, pre_psi3, pre_psi4, psi_dot_comm_1, psi_dot_comm_2, psi_dot_comm_3, psi_dot_comm_4","pre_psi1 -> DM_sub.pre_psi1_in, pre_psi1 -> VER_sub.pre_psi1, pre_psi1 -> UNV_sub.pre_psi1, pre_psi2 -> DM_sub.pre_psi2_in, pre_psi2 -> VER_sub.pre_psi2, pre_psi2 -> UNV_sub.pre_psi2, pre_psi3 -> DM_sub.pre_psi3_in, pre_psi3 -> VER_sub.pre_psi3, pre_psi3 -> UNV_sub.pre_psi3, pre_psi4 -> DM_sub.pre_psi4_in, pre_psi4 -> VER_sub.pre_psi4, pre_psi4 -> UNV_sub.pre_psi4, DM_sub.psi_dot_comm_1_dm -> psi_dot_comm_1, DM_sub.psi_dot_comm_2_dm -> psi_dot_comm_2, DM_sub.psi_dot_comm_3_dm -> psi_dot_comm_3, DM_sub.psi_dot_comm_4_dm -> psi_dot_comm_4, UNV_sub.psi_dot_comm_1 -> DM_sub.psi_dot_comm_1_unverified_in, UNV_sub.psi_dot_comm_2 -> DM_sub.psi_dot_comm_2_unverified_in, UNV_sub.psi_dot_comm_3 -> DM_sub.psi_dot_comm_3_unverified_in, UNV_sub.psi_dot_comm_4 -> DM_sub.psi_dot_comm_4_unverified_in, VER_sub.psi_dot_comm_1 -> DM_sub.psi_dot_comm_1_verified_in, VER_sub.psi_dot_comm_2 -> DM_sub.psi_dot_comm_2_verified_in, VER_sub.psi_dot_comm_3 -> DM_sub.psi_dot_comm_3_verified_in, VER_sub.psi_dot_comm_4 -> DM_sub.psi_dot_comm_4_verified_in"
890-isolette_KSU_Isolette_isolette_single_sensor_4,"heat_source, temperature_sensor, thermostat","heat_loss, air_temp, on_heater, on_alarm",
890-isolette_KSU_Isolette_isolette_single_sensor_5,"heat_source, temperature_sensor, thermostat","heat_loss, air_temp, on_heater, on_alarm",
890-isolette_KSU_Isolette_operator_interface_impl_1,"temp_display, status_display, desired_set, alarm_set","display_temp, reg_status, mon_status, lower_desired_temp, upper_desired_temp, lower_alarm_temp, upper_alarm_temp, air_temp, reg_status, mon_status, lower_desired_temp, upper_desired_temp, lower_alarm_temp, upper_alarm_temp","display_temp -> temp_display.air_temp, reg_status -> status_display.reg_status, mon_status -> status_display.mon_status, desired_set.lower_desired_temp -> lower_desired_temp, desired_set.upper_desired_temp -> upper_desired_temp, alarm_set.lower_alarm_temp -> lower_alarm_temp, alarm_set.upper_alarm_temp -> upper_alarm_temp"
890-isolette_KSU_Isolette_operator_interface_impl_2,"temp_display, status_display, desired_set, alarm_set","display_temp, reg_status, mon_status, lower_desired_temp, upper_desired_temp, lower_alarm_temp, upper_alarm_temp, air_temp, reg_status, mon_status, lower_desired_temp, upper_desired_temp, lower_alarm_temp, upper_alarm_temp","display_temp -> temp_display.air_temp, reg_status -> status_display.reg_status, mon_status -> status_display.mon_status, desired_set.lower_desired_temp -> lower_desired_temp, desired_set.upper_desired_temp -> upper_desired_temp, alarm_set.lower_alarm_temp -> lower_alarm_temp, alarm_set.upper_alarm_temp -> upper_alarm_temp"
890-isolette_KSU_Isolette_thermostat_single_sensor_impl_5,"regulate_temp, manage_heat_source, monitor_temp, manage_alarm","air_temp, on_heater, on_alarm, current_temp, on_heater, current_temp, on_heater, current_temp, on_alarm, current_temp, on_alarm","air_temp -> regulate_temp.manage_heat_source.current_temp, air_temp -> monitor_temp.manage_alarm.current_temp, regulate_temp.manage_heat_source.on_heater -> on_heater, monitor_temp.manage_alarm.on_alarm -> on_alarm"
AADL-Architecture-of-Smart-Parking-_InformationServiceProvider_ISP_impl_1,"sub_hw_bus, sub_TIC, collection",bus_access,sub_hw_bus -> sub_TIC.bus_access
AADL-Architecture-of-Smart-Parking-_RSE_RSEOwner_impl_1,"RSE_ElectricChargeSupportProvider, RSE_WorkzoneSafetyProvider, RSE_TravelInformationCommunicationProvider, RSE_TrafficMeteringProvider, RSE_SpeedManagementProvider","RSE_ECSP_data_in, RSE_ECSP_data_out, RSE_WSP_data_in, RSE_WSP_data_out, RSE_TICP_data_in, RSE_TICP_data_out, RSE_TMP_data_in, RSE_TMP_data_out, RSE_SMP_data_in, RSE_SMP_data_out",
AADL-Architecture-of-Smart-Parking-_SmartParkingSystem_tispSys_impl_1,"sub_driver, sub_hardwareComm, sub_vehicleOBE, sub_roadsideOBE, sub_parkingManager, sub_RSE_ElectricChargeSupportProvider, sub_RSE_WorkzoneSafetyProvider, sub_RSE_TravelInformationCommunicationProvider, sub_RSE_TrafficMeteringProvider, sub_RSE_SpeedManagementProvider, sub_TIC, collection","signal_in, signal2_in, signal3_in, DriverInfo_input, DriverOut, signal_out, parking_data_received, signal_out, parking_data_received, signal_out, signal_in, RSE_ECSP_data_in, RSE_ECSP_data_out, RSE_WSP_data_in, RSE_WSP_data_out, RSE_TICP_data_in, RSE_TICP_data_out, RSE_TMP_data_in, RSE_TMP_data_out, RSE_SMP_data_in, RSE_SMP_data_out, bus_access","signal_in -> sub_RSE_ElectricChargeSupportProvider.RSE_ECSP_data_in, signal2_in -> sub_RSE_TravelInformationCommunicationProvider.RSE_TICP_data_in, signal3_in -> sub_parkingManager.signal_in, sub_hardwareComm -> sub_TIC.bus_access, sub_parkingManager.signal_out -> sub_driver.DriverInfo_input, sub_RSE_ElectricChargeSupportProvider.RSE_ECSP_data_out -> sub_roadsideOBE.parking_data_received, sub_RSE_TravelInformationCommunicationProvider.RSE_TICP_data_out -> sub_vehicleOBE.parking_data_received"
aadl-bottle-filling_BottleFilling_BottleFillingSystem_impl_1,"operator_interface, main_bus, water_pipe, filter, quality_sensor, filling_valve, bottle_sensor, bottle_conveyor, main_ram, control_system, water_input_thread, filling_thread, conveyor_thread, control_thread, operator_input_thread, main_processor, ram","control_commands, water_flow, bus_access, filter_needs_changing, bus_access, water_quality, bus_access, valve_operate, bus_access, bottle_in_place, bottle_full, bus_access, set_conveyor_speed, conveyor_speed, start_stop_conveyor, bus_access, bus_access, control_commands, water_flow, water_quality, set_conveyor_speed, current_conveyor_speed, change_filter_in, valve_operate, bottle_in_place, bottle_full, conveyor_on, water_flow_in, quality_in, water_info_out, filter_in, water_info_in, valve_out, bottle_in_place_in, bottle_full_in, set_conveyor_speed_out, current_conveyor_speed_in, conveyor_on_out, control_commands_in, valve_in, valve_out, conveyor_in, conveyor_out, control_commands_in, control_commands_out, bus_access, bus_access","water_input_thread.water_info_out -> filling_thread.water_info_in, filling_thread.valve_out -> control_thread.valve_in, conveyor_thread.conveyor_on_out -> control_thread.conveyor_in, operator_input_thread.control_commands_out -> control_thread.control_commands_in, operator_interface.control_commands -> control_system.operator_input_thread.control_commands_in, main_bus -> water_pipe.bus_access, main_bus -> filter.bus_access, main_bus -> quality_sensor.bus_access, main_bus -> filling_valve.bus_access, main_bus -> bottle_sensor.bus_access, main_bus -> bottle_conveyor.bus_access, main_bus -> main_processor.bus_access, main_bus -> main_ram.bus_access, water_pipe.water_flow -> control_system.water_input_thread.water_flow_in, filter.filter_needs_changing -> control_system.water_input_thread.filter_in, quality_sensor.water_quality -> control_system.water_input_thread.quality_in, bottle_sensor.bottle_in_place -> control_system.filling_thread.bottle_in_place_in, bottle_sensor.bottle_full -> control_system.filling_thread.bottle_full_in, bottle_conveyor.conveyor_speed -> control_system.conveyor_thread.current_conveyor_speed_in, main_ram.bus_access -> main_bus, control_system.conveyor_thread.set_conveyor_speed_out -> bottle_conveyor.set_conveyor_speed, control_system.control_thread.valve_out -> filling_valve.valve_operate, control_system.control_thread.conveyor_out -> bottle_conveyor.start_stop_conveyor"
aadl-car-example_CarSystem_MyCar_impl_1,"ui, ud, wrs, bp, act, cc, computeThrottleSettingProcess, compute_throttle_setting, scanCCInputProcess, scan_cc_ports, computeVelocityProcess, compute_velocity, speedControlLoopProcess, speed_control_loop, cc_mcu, CANbus, ram, cpu","ui_cc, ud_cc, wrs_cc, bp_cc, act_cc, cc_ui, cc_ud, cc_wrs, cc_bp, cc_ca, cc_desired_speed, cc_throttle_setting, desired_speed, throttle_setting, cc_wrs, cc_bp, cc_run, brake_status, wheel_pulse, run_cc, cc_wrs, cc_inst_velocity, wheel_pulse, inst_velocity, cc_run_cc, cc_inst_velocity, cc_desired_speed, run_cc, inst_velocity, desired_speed, CanBA, PCIba, CanBA, PCIBA","scanCCInputProcess.scan_cc_ports.run_cc -> speedControlLoopProcess.speed_control_loop.run_cc, computeVelocityProcess.compute_velocity.inst_velocity -> speedControlLoopProcess.speed_control_loop.inst_velocity, speedControlLoopProcess.speed_control_loop.desired_speed -> computeThrottleSettingProcess.compute_throttle_setting.desired_speed, ui.ui_cc -> cc.cc_ui, wrs.wrs_cc -> cc.scanCCInputProcess.scan_cc_ports.wheel_pulse, wrs.wrs_cc -> cc.computeVelocityProcess.compute_velocity.wheel_pulse, bp.bp_cc -> cc.scanCCInputProcess.scan_cc_ports.brake_status, cc.cc_ud -> ud.ud_cc, cc.computeThrottleSettingProcess.compute_throttle_setting.throttle_setting -> act.act_cc"
aadl-car-example_HardwarePlatform_cc_mcu_dual_1,"can_bus, pci_bus, ram, rom, power_pc","CanBA, PCIba, PCIba, CanBA, PCIBA","CanBA -> can_bus, can_bus -> power_pc.CanBA, can_bus -> CanBA, pci_bus -> ram.PCIba, pci_bus -> rom.PCIba, pci_bus -> power_pc.PCIBA, ram.PCIba -> pci_bus, rom.PCIba -> pci_bus, power_pc.CanBA -> can_bus, power_pc.PCIBA -> pci_bus"
aadl-car-example_HardwarePlatform_cc_mcu_impl_1,"CANbus, ram, cpu","CanBA, PCIba, CanBA, PCIBA",
aadl-car-example_HardwarePlatform_cc_mcu_single_1,"can_bus, pci_bus, ram, rom, power_pc","CanBA, PCIba, PCIba, CanBA, PCIBA","CanBA -> can_bus, can_bus -> power_pc.CanBA, can_bus -> CanBA, pci_bus -> ram.PCIba, pci_bus -> rom.PCIba, pci_bus -> power_pc.PCIBA, ram.PCIba -> pci_bus, rom.PCIba -> pci_bus, power_pc.CanBA -> can_bus, power_pc.PCIBA -> pci_bus"
aadl-car-example_SoftwareApps_CruiseControl_impl_1,"computeThrottleSettingProcess, compute_throttle_setting, scanCCInputProcess, scan_cc_ports, computeVelocityProcess, compute_velocity, speedControlLoopProcess, speed_control_loop","cc_ui, cc_ud, cc_wrs, cc_bp, cc_ca, cc_desired_speed, cc_throttle_setting, desired_speed, throttle_setting, cc_wrs, cc_bp, cc_run, brake_status, wheel_pulse, run_cc, cc_wrs, cc_inst_velocity, wheel_pulse, inst_velocity, cc_run_cc, cc_inst_velocity, cc_desired_speed, run_cc, inst_velocity, desired_speed","cc_wrs -> scanCCInputProcess.scan_cc_ports.wheel_pulse, cc_wrs -> computeVelocityProcess.compute_velocity.wheel_pulse, cc_bp -> scanCCInputProcess.scan_cc_ports.brake_status, computeThrottleSettingProcess.compute_throttle_setting.throttle_setting -> cc_ca, scanCCInputProcess.scan_cc_ports.run_cc -> speedControlLoopProcess.speed_control_loop.run_cc, computeVelocityProcess.compute_velocity.inst_velocity -> speedControlLoopProcess.speed_control_loop.inst_velocity, speedControlLoopProcess.speed_control_loop.desired_speed -> computeThrottleSettingProcess.compute_throttle_setting.desired_speed"
AADL-Designer_CruiseControl_Cruisecontrollaws_Model_1,"P_Cruisecontrol_Process, T_Cruise1, T_Cruise2","Cruiseactive, Refspd_Mph, Autospd_Mph, Throttlepos_In, Cruiseactive, Refspd_Mph, Autospd_Mph, Throttlepos_In, Cruiseactive, Refspd_Mph, Autospd_Mph, Filautospd_Mph, Filrefspd_Mph, Filautospd_Mph, Filrefspd_Mph, Throttlepos_In",
AADL-Designer_CruiseControl_Cruisecontrol_Generic_1,"Lan, Hci_Processor, Ccl_Processor, S_Hci, P_Hci_Process, T_Buttonpanel, T_Drivermodelogic, T_Refspd, T_Instrumentpanel, S_Cruisecontrollaws, P_Cruisecontrol_Process, T_Cruise1, T_Cruise2","Breakpedalpressed, Clutchpedalpressed, Autospd_Mph, Engspd_Rpm, Throttlepos_In, B_Lan, B_Lan, Breakpedalpressed, Clutchpedalpressed, Autospd_Mph, Engspd_Rpm, Cruiseactive, Refspd_Mph, Breakpedalpressed, Clutchpedalpressed, Autospd_Mph, Engspd_Rpm, Cruiseactive, Refspd_Mph, Activate, Cancel, Onnotoff, Incspeed, Decspd, Breakpedalpressed, Clutchpedalpressed, Activate, Cancel, Onnotoff, Cruiseactive, Activate, Cruiseactive, Incspeed, Decspd, Refspd_Mph, Autospd_Mph, Engspd_Rpm, Refspd_Mph, Cruiseactive, Refspd_Mph, Autospd_Mph, Throttlepos_In, Cruiseactive, Refspd_Mph, Autospd_Mph, Throttlepos_In, Cruiseactive, Refspd_Mph, Autospd_Mph, Filautospd_Mph, Filrefspd_Mph, Filautospd_Mph, Filrefspd_Mph, Throttlepos_In",
AADL-Designer_CruiseControl_Hci_Model_1,"P_Hci_Process, T_Buttonpanel, T_Drivermodelogic, T_Refspd, T_Instrumentpanel","Breakpedalpressed, Clutchpedalpressed, Autospd_Mph, Engspd_Rpm, Cruiseactive, Refspd_Mph, Breakpedalpressed, Clutchpedalpressed, Autospd_Mph, Engspd_Rpm, Cruiseactive, Refspd_Mph, Activate, Cancel, Onnotoff, Incspeed, Decspd, Breakpedalpressed, Clutchpedalpressed, Activate, Cancel, Onnotoff, Cruiseactive, Activate, Cruiseactive, Incspeed, Decspd, Refspd_Mph, Autospd_Mph, Engspd_Rpm, Refspd_Mph",
aadl-examples_FC_FlightController_Impl_1,GPS,"UART, uart_recv, uart_send, position",GPS.position -> uart_send
aadl-examples_FC_FlightController_Impl_2,GPS,"UART, uart_recv, uart_send, position",GPS.position -> uart_send
aadl-examples_GS_GroundStation_Impl_1,"BUS_HW, RADIO_HW, MEM_HW, PROC_SW, RadioDriver, SendMessagesServiceGS, PROC_HW","RFA, radio_recv, radio_send, recv_data_in, recv_data_out, send_data_in, send_data_out, GSA, RFA, GSA, recv_data, send_data, recv_data, send_data, AutomationRequest, OperatingRegion, LineSearchTask, OperatingRegion, LineSearchTask, AutomationRequest, GSA","SendMessagesServiceGS.OperatingRegion -> RadioDriver.OperatingRegion, SendMessagesServiceGS.LineSearchTask -> RadioDriver.LineSearchTask, SendMessagesServiceGS.AutomationRequest -> RadioDriver.AutomationRequest, RFA -> RADIO_HW.RFA, radio_recv -> RADIO_HW.recv_data_in, BUS_HW -> RADIO_HW.GSA, BUS_HW -> PROC_HW.GSA, BUS_HW -> MEM_HW.GSA, RADIO_HW.recv_data_out -> PROC_SW.RadioDriver.recv_data, RADIO_HW.send_data_out -> radio_send, RADIO_HW.GSA -> BUS_HW, RADIO_HW.RFA -> RFA, MEM_HW.GSA -> BUS_HW, PROC_SW.RadioDriver.send_data -> RADIO_HW.send_data_in, PROC_HW.GSA -> BUS_HW"
aadl-examples_GS_GroundStation_Impl_2,"BUS_HW, RADIO_HW, MEM_HW, PROC_SW, RadioDriver, SendMessagesServiceGS, PROC_HW","RFA, radio_recv, radio_send, recv_data_in, recv_data_out, send_data_in, send_data_out, GSA, RFA, GSA, recv_data, send_data, recv_data, send_data, AutomationRequest, OperatingRegion, LineSearchTask, OperatingRegion, LineSearchTask, AutomationRequest, GSA","SendMessagesServiceGS.OperatingRegion -> RadioDriver.OperatingRegion, SendMessagesServiceGS.LineSearchTask -> RadioDriver.LineSearchTask, SendMessagesServiceGS.AutomationRequest -> RadioDriver.AutomationRequest, RFA -> RADIO_HW.RFA, radio_recv -> RADIO_HW.recv_data_in, BUS_HW -> RADIO_HW.GSA, BUS_HW -> PROC_HW.GSA, BUS_HW -> MEM_HW.GSA, RADIO_HW.recv_data_out -> PROC_SW.RadioDriver.recv_data, RADIO_HW.send_data_out -> radio_send, RADIO_HW.GSA -> BUS_HW, RADIO_HW.RFA -> RFA, MEM_HW.GSA -> BUS_HW, PROC_SW.RadioDriver.send_data -> RADIO_HW.send_data_in, PROC_HW.GSA -> BUS_HW"
aadl-examples_Hardware_PCB_clock_1,"main_bus, maintenance, nic, timers, ebc, cpu, ram, rom, hmi, power_bus, power, internal_maintenance_bus, clock_controller","sense, ui_touch, act, ui_image, ui_sound, connectors, serial_bus, usb_bus, lvds_bus, hdmi_bus, vga_bus, ethernet, maintenance_bus, maintenance_bus, provision_bus, system_bus, power_supply, mp_clock, mtm_bus, system_bus, ethernet, power_supply, nic_clock, mtm_bus, system_bus, peripheral_power, system_bus, serial_bus, usb_bus, lvds_bus, power_supply, system_bus, mtm_bus, gpio, cpu_clock, power_supply, system_bus, power_supply, mtm_bus, system_bus, power_supply, mtm_bus, system_bus, power_supply, dc_clock, sc_clock, mtm_bus, hdmi_bus, vga_bus, ui_image, ui_sound, ui_touch, power_supply, system_bus, peripheral_power, mtm_bus, cpu_clock, nic_clock, mp_clock, dc_clock, sc_clock, clk_pwr","sense.ui_touch -> hmi.ui_touch, ethernet -> nic.ethernet, maintenance_bus -> maintenance.maintenance_bus, main_bus -> cpu.ram.system_bus, main_bus -> cpu.rom.system_bus, main_bus -> ebc.system_bus, main_bus -> nic.system_bus, main_bus -> hmi.system_bus, main_bus -> maintenance.system_bus, main_bus -> power.system_bus, maintenance.mtm_bus -> internal_maintenance_bus, nic.ethernet -> ethernet, timers.system_bus -> main_bus, ebc.serial_bus -> connectors.serial_bus, ebc.usb_bus -> connectors.usb_bus, ebc.lvds_bus -> connectors.lvds_bus, hmi.hdmi_bus -> connectors.hdmi_bus, hmi.vga_bus -> connectors.vga_bus, hmi.ui_image -> act.ui_image, hmi.ui_sound -> act.ui_sound, power_bus -> cpu.ram.power_supply, power_bus -> cpu.rom.power_supply, power_bus -> maintenance.power_supply, power_bus -> nic.power_supply, power_bus -> ebc.power_supply, power_bus -> hmi.power_supply, power.power_supply -> power_bus, internal_maintenance_bus -> cpu.ram.mtm_bus, internal_maintenance_bus -> cpu.rom.mtm_bus, internal_maintenance_bus -> nic.mtm_bus, internal_maintenance_bus -> hmi.mtm_bus, clock_controller.cpu_clock -> cpu.cpu_clock, clock_controller.nic_clock -> nic.nic_clock, clock_controller.mp_clock -> maintenance.mp_clock, clock_controller.dc_clock -> hmi.dc_clock, clock_controller.sc_clock -> hmi.sc_clock"
aadl-examples_Hardware_PCB_i_1,"main_bus, maintenance, nic, timers, ebc, cpu, ram, rom, hmi","sense, ui_touch, act, ui_image, ui_sound, connectors, serial_bus, usb_bus, lvds_bus, hdmi_bus, vga_bus, ethernet, maintenance_bus, maintenance_bus, provision_bus, system_bus, power_supply, mp_clock, mtm_bus, system_bus, ethernet, power_supply, nic_clock, mtm_bus, system_bus, peripheral_power, system_bus, serial_bus, usb_bus, lvds_bus, power_supply, system_bus, mtm_bus, gpio, cpu_clock, power_supply, system_bus, power_supply, mtm_bus, system_bus, power_supply, mtm_bus, system_bus, power_supply, dc_clock, sc_clock, mtm_bus, hdmi_bus, vga_bus, ui_image, ui_sound, ui_touch","sense.ui_touch -> hmi.ui_touch, ethernet -> nic.ethernet, maintenance_bus -> maintenance.maintenance_bus, main_bus -> cpu.ram.system_bus, main_bus -> cpu.rom.system_bus, main_bus -> ebc.system_bus, main_bus -> nic.system_bus, main_bus -> hmi.system_bus, main_bus -> maintenance.system_bus, nic.ethernet -> ethernet, timers.system_bus -> main_bus, ebc.serial_bus -> connectors.serial_bus, ebc.usb_bus -> connectors.usb_bus, ebc.lvds_bus -> connectors.lvds_bus, hmi.hdmi_bus -> connectors.hdmi_bus, hmi.vga_bus -> connectors.vga_bus, hmi.ui_image -> act.ui_image, hmi.ui_sound -> act.ui_sound"
aadl-examples_Hardware_PCB_mp_1,"main_bus, maintenance, nic, timers, ebc, cpu, ram, rom, hmi, power_bus, power, internal_maintenance_bus","sense, ui_touch, act, ui_image, ui_sound, connectors, serial_bus, usb_bus, lvds_bus, hdmi_bus, vga_bus, ethernet, maintenance_bus, maintenance_bus, provision_bus, system_bus, power_supply, mp_clock, mtm_bus, system_bus, ethernet, power_supply, nic_clock, mtm_bus, system_bus, peripheral_power, system_bus, serial_bus, usb_bus, lvds_bus, power_supply, system_bus, mtm_bus, gpio, cpu_clock, power_supply, system_bus, power_supply, mtm_bus, system_bus, power_supply, mtm_bus, system_bus, power_supply, dc_clock, sc_clock, mtm_bus, hdmi_bus, vga_bus, ui_image, ui_sound, ui_touch, power_supply, system_bus, peripheral_power, mtm_bus","sense.ui_touch -> hmi.ui_touch, ethernet -> nic.ethernet, maintenance_bus -> maintenance.maintenance_bus, main_bus -> cpu.ram.system_bus, main_bus -> cpu.rom.system_bus, main_bus -> ebc.system_bus, main_bus -> nic.system_bus, main_bus -> hmi.system_bus, main_bus -> maintenance.system_bus, main_bus -> power.system_bus, maintenance.mtm_bus -> internal_maintenance_bus, nic.ethernet -> ethernet, timers.system_bus -> main_bus, ebc.serial_bus -> connectors.serial_bus, ebc.usb_bus -> connectors.usb_bus, ebc.lvds_bus -> connectors.lvds_bus, hmi.hdmi_bus -> connectors.hdmi_bus, hmi.vga_bus -> connectors.vga_bus, hmi.ui_image -> act.ui_image, hmi.ui_sound -> act.ui_sound, power_bus -> cpu.ram.power_supply, power_bus -> cpu.rom.power_supply, power_bus -> maintenance.power_supply, power_bus -> nic.power_supply, power_bus -> ebc.power_supply, power_bus -> hmi.power_supply, power.power_supply -> power_bus, internal_maintenance_bus -> cpu.ram.mtm_bus, internal_maintenance_bus -> cpu.rom.mtm_bus, internal_maintenance_bus -> nic.mtm_bus, internal_maintenance_bus -> hmi.mtm_bus"
aadl-examples_Hardware_PCB_power_1,"main_bus, maintenance, nic, timers, ebc, cpu, ram, rom, hmi, power_bus, power","sense, ui_touch, act, ui_image, ui_sound, connectors, serial_bus, usb_bus, lvds_bus, hdmi_bus, vga_bus, ethernet, maintenance_bus, maintenance_bus, provision_bus, system_bus, power_supply, mp_clock, mtm_bus, system_bus, ethernet, power_supply, nic_clock, mtm_bus, system_bus, peripheral_power, system_bus, serial_bus, usb_bus, lvds_bus, power_supply, system_bus, mtm_bus, gpio, cpu_clock, power_supply, system_bus, power_supply, mtm_bus, system_bus, power_supply, mtm_bus, system_bus, power_supply, dc_clock, sc_clock, mtm_bus, hdmi_bus, vga_bus, ui_image, ui_sound, ui_touch, power_supply, system_bus, peripheral_power, mtm_bus","sense.ui_touch -> hmi.ui_touch, ethernet -> nic.ethernet, maintenance_bus -> maintenance.maintenance_bus, main_bus -> cpu.ram.system_bus, main_bus -> cpu.rom.system_bus, main_bus -> ebc.system_bus, main_bus -> nic.system_bus, main_bus -> hmi.system_bus, main_bus -> maintenance.system_bus, main_bus -> power.system_bus, nic.ethernet -> ethernet, timers.system_bus -> main_bus, ebc.serial_bus -> connectors.serial_bus, ebc.usb_bus -> connectors.usb_bus, ebc.lvds_bus -> connectors.lvds_bus, hmi.hdmi_bus -> connectors.hdmi_bus, hmi.vga_bus -> connectors.vga_bus, hmi.ui_image -> act.ui_image, hmi.ui_sound -> act.ui_sound, power_bus -> cpu.ram.power_supply, power_bus -> cpu.rom.power_supply, power_bus -> maintenance.power_supply, power_bus -> nic.power_supply, power_bus -> ebc.power_supply, power_bus -> hmi.power_supply, power.power_supply -> power_bus"
aadl-examples_Human_Machine_Interface_HMI_i_1,"ts, dc, sp, sc","system_bus, power_supply, dc_clock, sc_clock, mtm_bus, hdmi_bus, vga_bus, ui_image, ui_sound, ui_touch, ui_image, image, ui_touch, finger_location, system_bus, video_bus, dc_clock, power_supply, mtm_bus, hdmi_bus, vga_bus, audio_bus, sound, system_bus, audio_bus, power_supply, sc_clock, mtm_bus",
